# id	title	url	count	median_score	popularity
33360171	Which Emoji Scissors Close?	https://wh0.github.io/2020/01/02/scissors.html	3	1545	4635
33368032	Websites that look like desktop GUIs	https://simone.computer/#/webdesktops	3	981	2943
33450753	Stripe laying off around 14% of workforce	https://stripe.com/en-au/newsroom/news/ceo-patrick-collisons-email-to-stripe-employees	3	997	2991
33466890	Firefox usage is down despite Mozilla\'s top exec pay going up	https://calpaterson.com/mozilla.html	3	1624	4872
33483165	-2000 Lines of Code (2004)	https://www.folklore.org/StoryView.py?story=Negative_2000_Lines_Of_Code.txt	8	324.5	2596
33506576	Microsoft is phoning home the content of PowerPoint slides	https://rogermexico.bearblog.dev/microsoft-is-phoning-home-the-content-of-your-powerpoint-slides/	3	734	2202
33516405	Sonic Pi is a code-based music creation and performance tool	https://sonic-pi.net/	6	301	1806
33554818	A Cypherpunk’s Manifesto (1993)	https://what.cd/	4	464	1856
33580983	14 years ago: the day Teller gave me the secret to my career in magic.	https://shwood.squarespace.com/news/2009/9/21/14-years-ago-the-day-teller-gave-me-the-secret-to-my-career.html	4	436.5	1746
33581856	Build Your Own Text Editor	https://viewsourcecode.org/snaptoken/kilo/	6	323	1938
33680661	Hacker News Parody Thread (2013)	https://bradconte.com/files/misc/HackerNewsParodyThread/	3	1049	3147
33683278	Computer input latency from 1977-2017 (2017)	https://danluu.com/input-lag/	6	349	2094
33715565	Japanese have been producing wood for 700 years without cutting down trees	https://dsfantiquejewelry.com/blogs/interesting-facts/the-ancient-japanese-technique-that-produces-lumber-without-cutting-trees	3	660	1980
33726831	The Art of Command Line	https://github.com/jlevy/the-art-of-command-line	6	466	2796
33730417	Show HN: Git-bug – Distributed bug tracker, or what to do when GitHub is down	https://github.com/MichaelMure/git-bug	5	380	1900
33760814	Designing Windows 95\'s User Interface (2018)	https://socket3.wordpress.com/2018/02/03/designing-windows-95s-user-interface/	7	274	1918
33809090	FTX’s collapse was a crime, not an accident	https://www.coindesk.com/layer2/2022/11/30/ftxs-collapse-was-a-crime-not-an-accident/	3	1082	3246
33811033	Don\'t End the Week with Nothing (2014)	https://training.kalzumeus.com/newsletters/archive/do-not-end-the-week-with-nothing	4	640	2560
33811705	A Vim Guide for Advanced Users	https://thevaluable.dev/vim-advanced/	4	505	2020
33819940	Memory Safe Languages in Android 13	https://security.googleblog.com/2022/12/memory-safe-languages-in-android-13.html	3	618	1854
33820575	Apple blocks Coinbase Wallet	https://twitter.com/coinbasewallet/status/1598354819735031809	3	939	2817
33823946	Platform certificates used to sign malware	https://bugs.chromium.org/p/apvi/issues/detail?id=100	3	684	2052
33827437	What I’ve Learned in 45 Years in the Software Industry	https://www.bti360.com/what-ive-learned-in-45-years-in-the-software-industry/	4	771.5	3086
33874292	Google: 90% of our engineers use the software you wrote (Homebrew), but...	https://twitter.com/mxcl/status/608682016205344768	4	642	2568
34008527	Twitter applies 7-day suspension to half a dozen journalists	https://www.washingtonpost.com/media/2022/12/15/twitter-journalists-suspended-musk/	3	1109	3327
34015142	“I have toyota corola”	https://daniel.haxx.se/blog/2016/11/14/i-have-toyota-corola/	3	1155	3465
34028079	John Carmack Leaves Meta	https://www.facebook.com/100006735798590/posts/i-resigned-from-my-position-as-an-executive-consultant-for-vr-with-meta-my-inter/3467566940144465/	4	1033.5	4134
34041985	Paul Graham is leaving Twitter for now	https://twitter.com/paulg/status/1604556563338887168	3	1077	3231
34056067	Spotifyd	https://github.com/Spotifyd/spotifyd	3	733	2199
34095032	24-core CPU and I can’t move my mouse (2017)	https://randomascii.wordpress.com/2017/07/09/24-core-cpu-and-i-cant-move-my-mouse/	4	612.5	2450
34095775	Don\'t Call Yourself a Programmer, and Other Career Advice (2011)	https://www.kalzumeus.com/2011/10/28/dont-call-yourself-a-programmer/	11	245	2695
34114886	Reverse Engineering TikTok\'s VM Obfuscation	https://nullpt.rs/reverse-engineering-tiktok-vm-1	3	683	2049
34124726	Life Is Short (2016)	https://paulgraham.com/vb.html	5	466	2330
34126403	OpenStreetMap Is in Trouble	https://blog.emacsen.net/blog/2018/02/16/osm-is-in-trouble/	3	1062	3186
34145799	Detecting the use of “curl | bash” server side (2016)	https://www.idontplaydarts.com/2016/04/detecting-curl-pipe-bash-server-side/	9	352	3168
34158318	Apple Lightning	https://nyansatan.github.io/lightning/	4	438	1752
34257837	How do I draw a pair of buttocks? (2014)	https://mathematica.stackexchange.com/questions/66538/how-do-i-draw-a-pair-of-buttocks	3	992	2976
34258858	Why SQLite succeeded as a database (2016)	https://changelog.com/podcast/201	3	589	1767
34284254	Always Bet on Text (2014)	https://graydon2.dreamwidth.org/193447.html	5	355	1775
34307705	Gail.com FAQ	https://gail.com/	4	715.5	2862
34332135	Select a muscle and it provides the exercises to workout the selected muscle	https://musclewiki.com/	4	1109	4436
34339459	Guerrilla guide to CNC machining, mold making, and resin casting (2015)	https://lcamtuf.coredump.cx/gcnc/	5	383	1915
34434636	Things I’ve learned in my 20 years as a software engineer	https://www.simplethread.com/20-things-ive-learned-in-my-20-years-as-a-software-engineer/	4	1081	4324
34437937	What not to write on your security clearance form (1988)	https://milk.com/wall-o-shame/security_clearance.html	4	533	2132
34511666	Mystery signal from a helicopter	https://www.windytan.com/2014/02/mystery-signal-from-helicopter.html	3	1101	3303
34530011	Realistic computer-generated handwriting	https://www.calligrapher.ai/	3	896	2688
34559928	Naval Architecture	https://ciechanow.ski/naval-architecture/	3	717	2151
34572263	The “Build Your Own Redis” Book Is Completed	https://build-your-own.org/blog/20230127_byor/	3	599	1797
34612162	Virtual DOM is pure overhead (2018)	https://svelte.dev/blog/virtual-dom-is-pure-overhead	6	322	1932
34624224	The “Talk”	https://www.smbc-comics.com/comic/the-talk-3	3	877	2631
34671637	The fraudulent claims made by IBM about Watson and AI (2021)	https://www.rogerschank.com/fraudulent-claims-made-by-IBM-about-Watson-and-AI	5	481	2405
34684325	Comparing the Same Project in Rust, Haskell, C++, Python, Scala and OCaml	https://thume.ca/2019/04/29/comparing-compilers-in-rust-haskell-c-and-python/	4	783	3132
34692137	Screw motivation, what you need is discipline	https://www.wisdomination.com/screw-motivation-what-you-need-is-discipline/	4	528	2112
34713202	Show HN: Filmbox, physically accurate film emulation, now on Linux and Windows	https://videovillage.co/filmbox/	3	658	1974
34723866	Gitlab to lay off 7% of staff	https://about.gitlab.com/blog/2023/02/09/gitlab-news/	3	703	2109
34726919	There are only four billion floats, so test them all (2014)	https://randomascii.wordpress.com/2014/01/27/theres-only-four-billion-floatsso-test-them-all/	7	252	1764
34741195	DuckDB – An embeddable SQL database like SQLite, but supports Postgres features	https://duckdb.org/	4	481	1924
34828012	Sloth – A Mac app that shows all open files, directories, sockets, etc.	https://github.com/sveinbjornt/Sloth	4	668	2672
34847611	TabFS: Mount your Browser Tabs as a Filesystem	https://omar.website/tabfs/	4	1216.5	4866
34849383	Hundreds of changes made to latest editions of Roald Dahl\'s books	https://www.telegraph.co.uk/news/2023/02/17/roald-dahl-books-rewritten-offensive-matilda-witches-twits/	4	544	2176
34898459	Great HN parody	https://www.linkedlistnyc.org/archive/issue_081.html	3	642	1926
34912300	Reverse engineering a mysterious UDP stream in my hotel (2016)	https://www.gkbrk.com/2016/05/hotel-music/	3	1044	3132
34966909	When you browse Instagram and find Tony Abbott\'s passport number	https://mango.pdf.zone/finding-former-australian-prime-minister-tony-abbotts-passport-number-on-instagram	4	1229	4916
35005259	Redox: Unix-Like Operating System in Rust	https://www.redox-os.org/	9	242	2178
35031545	Berkeley Systems “After Dark” screensavers recreated in CSS	https://www.bryanbraun.com/after-dark-css/	6	308	1848
35065785	Lessons learned from 15 years of SumatraPDF, an open source Windows app	https://blog.kowalczyk.info/article/2f72237a4230410a888acbfce3dc0864/lessons-learned-from-15-years-of-sumatrapdf-an-open-source-windows-app.html	5	350	1750
35090238	Secretive – macOS native app to store SSH keys in the Secure Enclave	https://github.com/maxgoedjen/secretive	6	292	1752
35130975	Advanced Compilers: Self-Guided Online Course	https://www.cs.cornell.edu/courses/cs6120/2020fa/self-guided/	3	827	2481
35209657	75% decline over 27 years in total flying insect biomass in protected areas	https://journals.plos.org/plosone/article?id=10.1371/journal.pone.0185809	3	901	2703
35258691	Wish HN: Happy Holidays	https://artsandculture.google.com/experiment/blob-opera/AAHWrq360NcGbw?cp=e30.	3	1139	3417
35277660	Framework announces AMD, new Intel gen, 16“ laptop and more	https://frame.work/	3	959	2877
35282293	You can\'t tell people anything (2004)	https://habitatchronicles.com/2004/04/you-cant-tell-people-anything/	6	405	2430
35297487	Gordon Moore has died	https://www.moore.org/article-detail?newsUrlName=in-memoriam-gordon-moore-1929-2023	3	2594	7782
35377589	Ian\'s Shoelace Site	https://www.fieggen.com/shoelace/index.htm	3	695	2085
35391484	Twitter\'s Recommendation Algorithm	https://blog.twitter.com/engineering/en_us/topics/open-source/2023/twitter-recommendation-algorithm	3	1700	5100
35448357	QOI: Lossless Image Compression in O(n) Time	https://phoboslab.org/log/2021/11/qoi-fast-lossless-image-compression	4	1057	4228
35478884	Building GitHub with Ruby on Rails	https://github.blog/2023-04-06-building-github-with-ruby-and-rails/	3	660	1980
35504053	Show HN: I wrote my own RTS game engine in C	https://github.com/eduard-permyakov/permafrost-engine	4	641.5	2566
35525294	I worked at Google for -10 days	https://andgein.ru/blog/all/20-i-worked-at-google-for-10-days/	3	727	2181
35528315	Substack Notes Launched	https://on.substack.com/p/notes	3	748	2244
35540154	Replacing my best friends with an LLM trained on 500k group chat messages	https://www.izzy.co/blogs/robo-boys.html	3	751	2253
35588797	Load Balancing	https://samwho.dev/load-balancing/	3	1143	3429
35611923	A search engine that favors text-heavy sites and punishes modern web design	https://search.marginalia.nu/	4	1995.5	7982
35684220	Ways to shoot yourself in the foot with Postgres	https://philbooth.me/blog/nine-ways-to-shoot-yourself-in-the-foot-with-postgresql	3	743	2229
35713518	Why is OAuth still hard in 2023?	https://www.nango.dev/blog/why-is-oauth-still-hard	3	642	1926
35753550	My product is my garden	https://herman.bearblog.dev/my-product-is-my-garden/	4	488.5	1954
35783189	Guidelines for Brutalist Web Design (2018)	https://brutalist-web.design/	4	477	1908
35790367	Mojo – a new programming language for AI developers	https://www.modular.com/mojo	3	643	1929
35800109	Writing a SQLite Clone from Scratch in C (2022)	https://cstack.github.io/db_tutorial/	8	451	3608
35841679	Click	https://clickclickclick.click/	4	614.5	2458
35886255	Story: Redis and its creator antirez	https://blog.brachiosoft.com/redis-en	3	589	1767
35926798	A Tunguska size burst destroyed Tall el-Hammam, Bronze Age city in Jordan Valley	https://www.nature.com/articles/s41598-021-97778-3	3	653	1959
35929362	Let’s fix font size	https://tonsky.me/blog/font-size/	4	469.5	1878
35935796	Get Started Making Music	https://learningmusic.ableton.com/	7	1176	8232
35950094	This word does not exist	https://www.thisworddoesnotexist.com/	4	1070	4280
35985240	User Inyerface – A worst-practice UI experiment	https://userinyerface.com/	4	653	2612
35999835	Orb Farm	https://orb.farm/	3	783	2349
36023706	Ditherpunk: The article I wish I had about monochrome image dithering	https://surma.dev/things/ditherpunk/	4	772.5	3090
36038796	Why do recipe writers lie about how long it takes to caramelize onions? (2012)	https://slate.com/human-interest/2012/05/how-to-cook-onions-why-recipe-writers-lie-and-lie-about-how-long-they-take-to-caramelize.html	4	489.5	1958
36087442	Paper Airplane Designs (2013)	https://www.foldnfly.com/#/1-1-1-1-1-1-1-1-2	4	538	2152
36102472	Apps Getting Worse	https://www.tbray.org/ongoing/When/202x/2021/08/07/Apps-Get-Worse	3	828	2484
36115671	How I Experience Web Today	https://how-i-experience-web-today.com/	4	517.5	2070
36129594	Plane: Open-Source Alternative to Jira	https://github.com/makeplane/plane	3	638	1914
36170409	I wrote Task Manager and I just remembered something	https://old.reddit.com/r/techsupport/comments/gqb915/i_wrote_task_manager_and_i_just_remembered/	5	413	2065
36175000	Fq: Jq for Binary Formats	https://github.com/wader/fq	4	560	2240
36175566	How the CIA used Crypto AG encryption devices to spy on countries for decades	https://www.washingtonpost.com/graphics/2020/world/national-security/cia-crypto-encryption-machines-espionage/	4	553.5	2214
36176198	My Business Card Runs Linux	https://www.thirtythreeforty.net/posts/2019/12/my-business-card-runs-linux/	4	1407.5	5630
36192777	Sandstorm: Open-source platform for self-hosting web apps	https://sandstorm.io/	7	434	3038
36216959	Octopuses, crabs and lobsters recognised as sentient beings under UK law (2021)	https://www.lse.ac.uk/News/Latest-news-from-LSE/2021/k-November-21/Octopuses-crabs-and-lobsters-welfare-protection	4	495	1980
36304685	Xerox scanners/photocopiers randomly alter numbers in scanned documents (2013)	https://www.dkriesel.com/en/blog/2013/0802_xerox-workcentres_are_switching_written_numbers_when_scanning	8	336.5	2692
36376669	A single line of code made a 24-core server slower than a laptop	https://pkolaczk.github.io/server-slower-than-a-laptop/	4	571.5	2286
36377875	Sennheiser HD 555 to HD 595 Mod	https://mikebeauchamp.com/misc/sennheiser-hd-555-to-hd-595-mod/	3	609	1827
36428046	French govt. says users of uBlock Origin, Signal etc. are potential terrorists	https://www.laquadrature.net/en/2023/06/05/criminalization-of-encryption-the-8-december-case/	3	923	2769
36433262	Making bracket pair colorization faster	https://code.visualstudio.com/blogs/2021/09/29/bracket-pair-colorization	3	715	2145
36433842	Revolt: Open-source alternative to Discord	https://revolt.chat/	6	402	2412
36436583	Mess with DNS	https://jvns.ca/blog/2021/12/15/mess-with-dns/	3	958	2874
36443747	Amazon cancels my account after exposing account lockout for “racist doorbell” [video]	https://www.youtube.com/watch?v=Kcohq313q00	3	750	2250
36467224	The \'Fuck You\' Pattern	https://cedwards.xyz/the-fuck-you-pattern/	4	872.5	3490
36543372	CSS-Only Chat	https://github.com/kkuchta/css-only-chat	4	652.5	2610
36556228	Fake reviews are illegal and subject to big fines under new FTC rules	https://www.washingtonpost.com/technology/2023/06/30/fake-reviews-online-ftc/	3	598	1794
36557679	Salary Negotiation: Make More Money, Be More Valued (2012)	https://www.kalzumeus.com/2012/01/23/salary-negotiation/	8	274	2192
36568192	55 GiB/s FizzBuzz	https://codegolf.stackexchange.com/questions/215216/high-throughput-fizz-buzz/236630#236630	4	899.5	3598
36636749	An oral history of Bank Python	https://calpaterson.com/bank-python.html	4	463	1852
36680835	Laws of UX	https://lawsofux.com/	5	535	2675
36740821	The Bus Ticket Theory of Genius	https://paulgraham.com/genius.html	3	1164	3492
36753225	LazyVim	https://www.lazyvim.org/	3	633	1899
36782018	Lazygit: A simple terminal UI for Git commands	https://github.com/jesseduffield/lazygit	6	395	2370
36799776	No-more-secrets: recreate the decryption effect seen in the 1992 movie Sneakers	https://github.com/bartobri/no-more-secrets	4	609	2436
36811554	I have written a JVM in Rust	https://andreabergia.com/blog/2023/07/i-have-written-a-jvm-in-rust/	3	718	2154
36817305	Web Environment Integrity API Proposal	https://github.com/RupertBenWiser/Web-Environment-Integrity	3	639	1917
36928043	What I would do if I ran Tarsnap (2014)	https://www.kalzumeus.com/2014/04/03/fantasy-tarsnap/	4	451	1804
36952796	Jujutsu – A Git-compatible DVCS that is both simple and powerful	https://github.com/martinvonz/jj	4	620.5	2482
36969018	How NAT Traversal Works	https://tailscale.com/blog/how-nat-traversal-works/	7	305	2135
36990215	Modern action films fetishize the body even as they desexualize it	https://bloodknife.com/everyone-beautiful-no-one-horny/	5	456	2280
37032286	The Alexander: Why did you build such a long piano?	https://www.alexanderpiano.nz/page/the-alexander-piano	3	884	2652
37043934	A digital museum of video game levels	https://noclip.website	4	450	1800
37057866	Pure Bash Bible	https://github.com/dylanaraps/pure-bash-bible	6	291	1746
37058674	G9.js: Automatically Interactive Graphics	https://omrelli.ug/g9/gallery/	3	631	1893
37060470	Akin’s Laws of Spacecraft Design	https://spacecraft.ssl.umd.edu/akins_laws.html	8	310	2480
37066680	Temptations of an open-source Chrome extension developer (2021)	https://github.com/extesy/hoverzoom/discussions/670	3	1123	3369
37073885	Speed Test	https://speed.cloudflare.com/	4	581	2324
37137448	Draw.io: Online Diagramming Website	https://github.com/jgraph/drawio	4	579.5	2318
37171294	Micro: Modern and intuitive terminal-based text editor	https://micro-editor.github.io/	8	349	2792
37239747	Common mistakes in salary negotiation	https://interviewing.io/blog/sabotage-salary-negotiation-before-even-start	3	629	1887
37248844	Code Llama, a state-of-the-art large language model for coding	https://ai.meta.com/blog/code-llama-large-language-model-coding/	5	673	3365
37250834	Hacker News Guidelines	https://news.ycombinator.com/newsguidelines.html	6	386	2316
37273245	C4: C in Four Functions (2014)	https://github.com/rswier/c4	5	436	2180
37276485	We need to reclaim our attention	https://www.theguardian.com/science/2022/jan/02/attention-span-focus-screens-apps-smartphones-social-media	3	636	1908
37315961	Most promoted and blocked domains among Kagi Search users	https://kagi.com/stats	4	524	2096
37340010	When your coworker does great work, tell their manager	https://jvns.ca/blog/2020/07/14/when-your-coworker-does-great-work-tell-their-manager/	3	1074	3222
37347447	Organic Maps	https://organicmaps.app/	3	1401	4203
37354881	ALiEn – a GPU-accelerated artificial life simulation program	https://alien-project.org/	4	446	1784
37359193	The Mystery of the Bloomfield Bridge	https://tylervigen.com/the-mystery-of-the-bloomfield-bridge	3	1028	3084
37426895	The Big List of Naughty Strings	https://github.com/minimaxir/big-list-of-naughty-strings	6	461.5	2769
37431644	Touch Pianist	https://touchpianist.com/	3	837	2511
37453616	The Decline of Usability	https://datagubbe.se/decusab/	4	641.5	2566
37468600	UK air traffic control meltdown	https://jameshaydon.github.io/nats-fail/	3	932	2796
37474066	Yt-dlp – A YouTube-dl fork with additional features and fixes	https://github.com/yt-dlp/yt-dlp	4	504.5	2018
37490241	Credit card debt collection	https://www.bitsaboutmoney.com/archive/the-waste-stream-of-consumer-finance/	3	778	2334
37499106	The Uselessness of Phenylephrine	https://www.science.org/content/blog-post/uselessness-phenylephrine	4	516	2064
37519418	Willingham sends Fables into the public domain	https://billwillingham.substack.com/p/willingham-sends-fables-into-the	3	733	2199
37532973	Tracking Austrian grocery prices by scraping store sites	https://mastodon.gamedev.place/@badlogic/111071396799790275	3	660	1980
37542236	What Silicon Valley gets about engineers that traditional companies do not	https://blog.pragmaticengineer.com/what-silicon-valley-gets-right-on-software-engineers/	3	805	2415
37554504	NSA\'s Backdoor Key from Lotus Notes	https://www.cypherspace.org/adam/hacks/lotus-nsa-key.html	5	442	2210
37576633	We can\'t send email more than 500 miles (2002)	https://web.mit.edu/jemorris/humor/500-miles	7	1034	7238
37613054	Show HN: Paisa – Open-Source Personal Finance Manager	https://paisa.fyi/	3	662	1986
37613747	I\'m all-in on server-side SQLite	https://fly.io/blog/all-in-on-sqlite-litestream/	4	783.5	3134
37622702	My solopreneur story	https://news.tonydinh.com/p/my-solopreneur-story-zero-to-45kmo	3	852	2556
37640816	Bitwarden: Free, open-source password manager	https://bitwarden.com/	8	381	3048
37650402	A journey into the shaken baby syndrome/abusive head trauma controversy	https://www.cambridgeblog.org/2023/05/a-journey-into-the-shaken-baby-syndrome-abusive-head-trauma-controversy/	3	1018	3054
37671419	Essence: Desktop operating system built from scratch	https://nakst.gitlab.io/essence	4	808.5	3234
37674139	The most copied StackOverflow snippet of all time is flawed (2019)	https://programming.guide/worlds-most-copied-so-snippet.html	6	368	2208
37713530	Flexbox Froggy	https://flexboxfroggy.com/	6	316	1896
37731798	Choose Boring Technology (2018)	https://boringtechnology.club/	6	399	2394
37750763	Show HN: We built a developer-first open-source Zapier alternative	https://trigger.dev	4	458.5	1834
37829061	Real-Time Tokyo Subway Map	https://minitokyo3d.com	4	460	1840
37842863	Beej\'s Guide to Network Programming (1994-2020)	https://beej.us/guide/bgnet/html/	4	635	2540
37889666	Lotus 1-2-3 For Linux	https://lock.cmpxchg8b.com/linux123.html	4	533	2132
37895446	Cockpit: Web-based graphical interface for servers	https://cockpit-project.org/	5	377	1885
37923732	Psytrance Guide	https://psytranceguide.com/	4	502	2008
37943963	Wireless Is a Trap	https://www.benkuhn.net/wireless/	7	474	3318
37952134	Can\'t you just right click?	https://lapcatsoftware.com/articles/unsigned.html	3	1169	3507
37954600	Hexagonal Grids (2013)	https://www.redblobgames.com/grids/hexagons/	10	337	3370
37965947	Ruffle – A Flash Player emulator written in Rust	https://ruffle.rs/	5	351	1755
37976894	How to make a CPU – a simple picture-based explanation	https://blog.robertelder.org/how-to-make-a-cpu/	4	476	1904
37982621	Protomaps – A free and open source map of the world	https://protomaps.com/	3	1001	3003
37985176	Software Disenchantment (2018)	https://tonsky.me/blog/disenchantment/	8	447	3576
37998983	Embeddings: What they are and why they matter	https://simonwillison.net/2023/Oct/23/embeddings/	3	668	2004
38053982	Actual is going open-source	https://actualbudget.com/open-source	4	470	1880
38055832	Show HN: Redbean – Single-file distributable web server	https://justine.lol/redbean/index.html	3	1998	5994
38074701	Use YouTube to improve your English pronunciation	https://youglish.com/	4	659	2636
38080951	Grist – Open core alternative to Airtable and Google Sheets	https://github.com/gristlabs/grist-core	4	525.5	2102
38097031	Rob Pike\'s Rules of Programming (1989)	https://users.ece.utexas.edu/~adnan/pike.html	6	428	2568
38109778	Biohacking Lite	https://karpathy.github.io/2020/06/11/biohacking-lite/	4	457.5	1830
38134861	Asciinema – Record and share terminal sessions	https://asciinema.org/	8	303.5	2428
38144400	NewPipe: A lightweight YouTube experience for Android	https://newpipe.net/	4	616.5	2466
38247300	Diamonds Suck	https://diamondssuck.com/	6	312.5	1875
38248532	Lessons I wish I had learned before I started teaching differential equations [pdf] (1997)	https://web.williams.edu/Mathematics/lg5/Rota.pdf	5	351	1755
38254153	Algorithms (2019)	https://jeffe.cs.illinois.edu/teaching/algorithms/	8	257.5	2060
38296667	Pointer Pointer (2012)	https://pointerpointer.com/	5	426	2130
38301801	Chrome users beware: Manifest v3 is deceitful and threatening	https://www.eff.org/deeplinks/2021/12/chrome-users-beware-manifest-v3-deceitful-and-threatening	4	579.5	2318
38312690	Boards are dangerous to founder/CEOs	https://reactionwheel.net/2021/11/your-boards-of-directors-is-probably-going-to-fire-you.html	3	718	2154
38371307	I tested four NVMe SSDs from four vendors – half lose FLUSH’d data on power loss	https://twitter.com/xenadu02/status/1495693475584557056	4	529.5	2118
38392931	Despite having just 5.8% sales, over 38% of bug reports come from Linux	https://old.reddit.com/r/gamedev/comments/qeqn3b/despite_having_just_58_sales_over_38_of_bug/	4	870	3480
38393032	Write libraries instead of services, where possible	https://catern.com/services.html	4	457.5	1830
38399740	Things You\'re Allowed to Do	https://milan.cvitkovic.net/writing/things_youre_allowed_to_do/	5	402	2010
38420111	They\'re Made Out of Meat (1991)	https://www.mit.edu/people/dpolicar/writing/prose/text/thinkingMeat.html	5	472	2360
38423469	Darling: macOS Translation Layer for Linux	https://www.darlinghq.org/	8	622	4976
38429080	Show HN: Tired of mobile games with IAP and ads, I made No-Bullshit Games	https://nobsgames.stavros.io/	4	480	1920
38464715	The Unix-Haters Handbook (1994) [pdf]	https://web.mit.edu/~simsong/www/ugh.pdf	11	189	2079
38471822	Ripgrep is faster than grep, ag, Git grep, ucg, pt, sift (2016)	https://blog.burntsushi.net/ripgrep/	5	390	1950
38482486	Common color mistakes and how to avoid them	https://blog.datawrapper.de/beautifulcolors/	4	571	2284
38485596	RavynOS – Finesse of macOS, freedom of FreeBSD	https://ravynos.com/	4	500	2000
38489307	Accidental database programming	https://sqlsync.dev/posts/stop-building-databases/	3	583	1749
38519257	A decade of Have I Been Pwned	https://www.troyhunt.com/a-decade-of-have-i-been-pwned/	3	677	2031
38566235	Goodbye, Clean Code	https://overreacted.io/goodbye-clean-code/	6	386	2316
38572675	The pro-Israel information war	https://jackpoulson.substack.com/p/inside-the-pro-israel-information	3	860	2580
38586767	Gooey: Turn almost any Python command line program into a GUI application	https://github.com/chriskiehl/Gooey	6	693	4158
38591084	Mechanical Watch	https://ciechanow.ski/mechanical-watch/	4	2626	10504
38663564	Adobe tricks users into a 12 month contract	https://twitter.com/darkpatterns/status/1489901640777973768	3	1607	4821
38672112	Ventoy	https://www.ventoy.net/en/index.html	3	594	1782
38732049	Rough.js: Create graphics with a hand-drawn, sketchy, appearance	https://roughjs.com/	6	372	2232
