# id	title	url	count	median_score	popularity
26184190	Perseverance Rover lands on Mars [video]	https://www.youtube.com/watch?v=gm0b_ijaYMQ	3	1663	4989
26239711	Free for Developers	https://free-for.dev/#/	4	568	2272
26297040	Not Lisp again....	https://funcall.blogspot.com/2009/03/not-lisp-again.html	7	266	1862
26347867	Banned C standard library functions in Git source code	https://github.com/git/git/blob/master/banned.h	4	689	2756
26373108	NFTs Are a Dangerous Trap	https://seths.blog/2021/03/nfts-are-a-dangerous-trap/	3	772	2316
26373539	507 Mechanical Movements (1868)	https://507movements.com	4	478.5	1914
26420665	Goodbye MongoDB, Hello PostgreSQL	https://developer.olery.com/blog/goodbye-mongodb-hello-postgresql/	3	802	2406
26420669	Linux Load Averages: Solving the Mystery	https://www.brendangregg.com/blog/2017-08-08/linux-load-averages.html	3	623	1869
26455493	Security.txt	https://securitytxt.org/	3	746	2238
26487854	GitHub, fuck your name change	https://mooseyanon.medium.com/github-f-ck-your-name-change-de599033bbbe	3	3353	10059
26586029	In Defense of Richard Stallman	https://geoff.greer.fm/2019/09/30/in-defense-of-richard-stallman/	3	744	2232
26591777	Employees are happier when led by people with deep expertise (2016)	https://hbr.org/2016/12/if-your-boss-could-do-your-job-youre-more-likely-to-be-happy-at-work	3	691	2073
26600135	NES.css – NES-Style CSS Framework	https://nostalgic-css.github.io/NES.css/	3	704	2112
26627556	Quick, Draw	https://quickdraw.withgoogle.com/	4	607.5	2430
26681672	How to do things safely in Bash (2018)	https://github.com/anordal/shellharden/blob/master/how_to_do_things_safely_in_bash.md	4	532.5	2130
26685244	How Doctors Die (2013)	https://www.saturdayeveningpost.com/2013/03/how-doctors-die/	3	589	1767
26750452	Scientists who say the lab-leak hypothesis for SARS-CoV-2 shouldn\'t be ruled out	https://www.technologyreview.com/2021/03/18/1021030/coronavirus-leak-wuhan-lab-scientists-conspiracy/	3	592	1776
26788149	A Wikipedia editor\'s long-running campaign	https://wikipedia.fivefilters.org/	3	748	2244
26982286	Yayagram	https://twitter.com/mrcatacroquer/status/1386318806411325440	4	639.5	2558
26991300	Internal Combustion Engine	https://ciechanow.ski/internal-combustion-engine/	4	1180	4720
27022120	Dave Herman’s contributions to Rust	https://brson.github.io/2021/05/02/rusts-most-unrecognized-contributor	3	641	1923
27044371	Please fix the AWS free tier before somebody gets hurt	https://cloudirregular.substack.com/p/please-fix-the-aws-free-tier-before	3	840	2520
27052313	Show HN: Pts.js – A library for visualization and creative coding	https://ptsjs.org/	3	611	1833
27233019	Learn CSS	https://web.dev/learn/css/	3	842	2526
27335940	It\'s time for us in the tech world to speak out about cryptocurrency	https://twitter.com/Pinboard/status/1399058952336277505	3	949	2847
27406132	The web sucks if you have a slow connection	https://danluu.com/web-bloat/	4	745.5	2982
27437600	Playdate – A New Handheld Gaming System	https://play.date/	3	1370	4110
27462369	Why Go Is Not Good	https://yager.io/programming/go.html	6	413	2478
27468908	Mathematics all-in-one cheat-sheet (2013) [pdf]	https://ourway.keybase.pub/mathematics_cheat_sheet.pdf	3	1060	3180
27577460	Fluid Paint	https://david.li/paint/	3	586	1758
27603912	A backlash against gender ideology is starting in universities	https://www.economist.com/international/2021/06/05/a-backlash-against-gender-ideology-is-starting-in-universities	3	651	1953
27648915	Mumble: Open-Source, Low Latency, High Quality Voice Chat	https://www.mumble.info/	3	591	1773
27654787	Estimates that mineral levels in vegetables have dropped by up to 90% since 1914	https://www.ncbi.nlm.nih.gov/pmc/articles/PMC6163803/	4	632	2528
27745184	Data Structure Visualizations	https://www.cs.usfca.edu/~galles/visualization/Algorithms.html	7	384	2688
27769440	All public GitHub code was used in training Copilot	https://twitter.com/NoraDotCodes/status/1412741339771461635	3	1017	3051
27839810	How to build a plugin system on the web and also sleep well at night	https://www.figma.com/blog/how-we-built-the-figma-plugin-system/	3	685	2055
27853392	Show HN: Wave function collapse algorithm	https://github.com/mxgmn/WaveFunctionCollapse	4	753.5	3014
27871043	Habits of Expert Software Designers	https://thereader.mitpress.mit.edu/habits-of-expert-software-designers/	4	443.5	1774
27872596	Zig cc: A drop-in replacement for GCC/Clang	https://andrewkelley.me/post/zig-cc-powerful-drop-in-replacement-gcc-clang.html	4	566	2264
28009042	The Inter typeface family	https://rsms.me/inter/	4	501.5	2006
28095632	Swiss Ph.D student’s dismissal spotlights China’s influence	https://www.nzz.ch/english/swiss-phd-students-dismissal-spotlights-chinas-influence-ld.1638771	3	694	2082
28133585	Culdesac Tempe: The first car-free neighborhood built from scratch in the US	https://culdesac.com/	3	597	1791
28143796	GitHub Codespaces	https://github.com/features/codespaces	3	1769	5307
28232627	The Lesson to Unlearn	https://paulgraham.com/lesson.html	3	1333	3999
28310633	Machine Learning Crash Course	https://developers.google.com/machine-learning/crash-course/	4	981.5	3926
28360139	Crontab.guru – cron schedule expression editor	https://crontab.guru/	6	309	1854
28379526	Exercism – Level up your programming skills	https://exercism.io	3	795	2385
28424845	Show HN: Search code in GitHub repos using regular expressions	https://grep.app	3	614	1842
28445174	Crafting “Crafting Interpreters”	https://journal.stuffwithstuff.com/2020/04/05/crafting-crafting-interpreters/	3	777	2331
28486133	Windows Subsystem for Linux GUI	https://github.com/microsoft/wslg	3	618	1854
28486389	Windy.com	https://windy.com	3	1052	3156
28509935	Why I Quit Being So Accommodating (1922)	https://mikecanex.wordpress.com/2012/12/26/1922-why-i-quit-being-so-accommodating/	3	650	1950
28544835	Home Assistant – open-source home automation	https://www.home-assistant.io/	4	561	2244
28564516	My FOSS Story	https://blog.burntsushi.net/foss/	3	833	2499
28591880	If I could bring one thing back to the internet it would be blogs	https://tttthis.com/blog/if-i-could-bring-one-thing-back-to-the-internet-it-would-be-blogs	4	899.5	3598
28592683	Advice to new managers: don\'t joke about firing people	https://staysaasy.com/engineering/2020/06/09/Don%27t-Joke.html	4	506.5	2026
28599349	Larry Ellison allegedly tried to have a professor fired for benchmarking Oracle	https://danluu.com/anon-benchmark/	4	660	2640
28626194	Be careful what you copy: Invisibly inserting usernames into text	https://medium.com/@umpox/be-careful-what-you-copy-invisibly-inserting-usernames-into-text-with-zero-width-characters-18b4e6f17b66	3	727	2181
28770937	How to permanently delete your Facebook account	https://www.facebook.com/help/224562897555674	3	648	1944
28771307	Twitch source code and customer data has reportedly been leaked	https://www.videogameschronicle.com/news/the-entirety-of-twitch-has-reportedly-been-leaked/	3	1271	3813
28829765	Operating Systems: From 0 to 1	https://tuhdo.github.io/os01/	3	709	2127
28894481	Show HN: Obsidian – A knowledge base that works on local Markdown files	https://obsidian.md/	4	855.5	3422
28895128	Facts every web dev should know before they burn out and turn to painting	https://www.baldurbjarnason.com/2021/100-things-every-web-developer-should-know/	3	615	1845
28924751	Overly analytical guide to escorting	https://knowingless.com/2021/10/19/becoming-a-whorelord-the-overly-analytical-guide-to-escorting/	3	826	2478
28926582	Brave Search Replaces Google as the Default Search Engine in the Brave Browser	https://brave.com/search-and-web-discovery/	3	738	2214
29010157	We only hire the trendiest	https://danluu.com/programmer-moneyball/	6	910	5460
29050351	Preindustrial workers worked fewer hours than today\'s (2009)	https://groups.csail.mit.edu/mac/users/rauch/worktime/hours_workweek.html	4	541.5	2166
29139902	A terrible schema from a clueless programmer	https://rachelbythebay.com/w/2021/11/06/sql/	3	842	2526
29175922	Tech sector job interviews assess anxiety, not software skills: study	https://news.ncsu.edu/2020/07/tech-job-interviews-anxiety/	4	1015.5	4062
29189467	Rich Harris joins Vercel to work on Svelte full time	https://twitter.com/Rich_Harris/status/1458822051263823875	3	907	2721
29193193	I\'m not a Woman in Tech	https://communequation.wordpress.com/2017/07/05/im-not-a-woman-in-tech/	3	876	2628
29263439	Org-Mode Is One of the Most Reasonable Markup Languages to Use for Text	https://karl-voit.at/2017/09/23/orgmode-as-markup-only/	5	518	2590
29272807	Relearn CSS layout	https://every-layout.dev/	3	985	2955
29383546	The poetry and brief life of a Foxconn worker	https://libcom.org/blog/xulizhi-foxconn-suicide-poetry	4	448	1792
29387761	4x Smaller, 50x Faster	https://blog.asciinema.org/post/smaller-faster/	3	758	2274
29430288	Design Tip: Never Use Black (2012)	https://ianstormtaylor.com/design-tip-never-use-black/	7	320	2240
29432451	Blender 3.0	https://www.blender.org/download/releases/3-0/	3	848	2544
29482351	Apple CEO Tim Cook \'secretly\' signed $275B deal with China in 2016	https://www.macrumors.com/2021/12/07/apple-ceo-tim-cook-secret-deal-with-china/	3	1209	3627
29483063	Things I Wish I\'d Known About Bash	https://zwischenzugs.com/2018/01/06/ten-things-i-wish-id-known-about-bash/	3	781	2343
29483070	How to write idempotent Bash scripts (2019)	https://arslan.io/2019/07/03/how-to-write-idempotent-bash-scripts/	4	492.5	1970
29505477	Log4j RCE Found	https://www.lunasec.io/docs/blog/log4j-zero-day/	3	1385	4155
29507458	Turning a MacBook into a Touchscreen with $1 of Hardware (2018)	https://www.anishathalye.com/2018/04/03/macbook-touchscreen/	5	524	2620
29531145	This website has 81% battery power remaining	https://solar.lowtechmagazine.com/power.html	4	780	3120
29535937	Adventures of putting 16 GB of RAM in a motherboard that doesn’t support it	https://www.downtowndougbrown.com/2019/04/adventures-of-putting-16-gb-of-ram-in-a-motherboard-that-doesnt-support-it/	3	817	2451
29541232	Typography of Neon Genesis Evangelion	https://fontsinuse.com/uses/28760/neon-genesis-evangelion	4	463	1852
29609388	Exa - A Modern Replacement for ls	https://the.exa.website/	5	355	1775
29656456	Websocketd – It\'s like CGI, twenty years later, for WebSockets	https://websocketd.com/	5	421	2105
29661935	This Page is Designed to Last	https://jeffhuang.com/designed_to_last/	3	1321	3963
29736369	The gift of it\'s your problem now	https://apenwarr.ca/log/20211229	3	756	2268
29760190	Google\'s “Director of Engineering” Hiring Test	https://www.gwan.com/blog/20160405.html	4	1166.5	4666
29768376	OpenDrop: An Open Source AirDrop Implementation	https://github.com/seemoo-lab/opendrop	4	620.5	2482
29837696	Syncthing is everything I used to love about computers	https://tonsky.me/blog/syncthing/	4	499	1996
29841231	After 3072 hours of manipulating BGP, a Nyancat was drawn on this RIPE interface	https://stat.ripe.net/widget/routing-history#w.resource=as15562&w.starttime=2017-01-15T00%3A00%3A00&w.endtime=2017-06-23T00%3A00%3A00&show=Maxmized	3	776	2328
29852783	DuckDuckGo Traffic	https://duckduckgo.com/traffic	6	518.5	3111
29873106	BitTorrent v2	https://blog.libtorrent.org/2020/09/bittorrent-v2/	4	766	3064
29890470	Nothing like this will be built again (2002)	https://www.antipope.org/charlie/blog-static/rants/nothing-like-this-will-be-buil.html	6	411	2466
29979098	Microsoft to Acquire Activision Blizzard	https://news.microsoft.com/2022/01/18/microsoft-to-acquire-activision-blizzard-to-bring-the-joy-and-community-of-gaming-to-everyone-across-every-device/	3	2051	6153
30005465	Make front end shit again	https://makefrontendshitagain.party/	3	681	2043
30024165	Show HN: FalsiScan – Make it look like a PDF has been hand signed and scanned	https://gitlab.com/edouardklein/falsisign	4	854.5	3418
30024985	“We have no reason to believe 5G is safe”	https://blogs.scientificamerican.com/observations/we-have-no-reason-to-believe-5g-is-safe/	3	925	2775
30051701	Huginn: Create agents that monitor and act on your behalf	https://github.com/huginn/huginn	4	786.5	3146
30080159	The Polygons of Another World	https://fabiensanglard.net/another_world_polygons/index.html	3	704	2112
30103085	RegExr	https://regexr.com/	5	349	1745
30118686	I got an FBI record at age 11 from dabbling in cryptography (2015)	https://web.stanford.edu/~learnest/les/crypto.htm	3	770	2310
30174518	Programming books you might want to consider reading	https://danluu.com/programming-books/	3	1019	3057
30193714	Do things, tell people (2012)	https://carl.flax.ie/dothingstellpeople.html	3	702	2106
30284820	Use of Google Analytics declared illegal by French data protection authority	https://www.cnil.fr/en/use-google-analytics-and-data-transfers-united-states-cnil-orders-website-manageroperator-comply	3	1172	3516
30322623	We at $Famous_company switched to $Hyped_technology	https://saagarjha.com/blog/2020/05/10/why-we-at-famous-company-switched-to-hyped-technology/	3	1224	3672
30341236	AMD to Acquire Xilinx	https://www.amd.com/en/corporate/xilinx-acquisition	3	593	1779
30358903	Music theory for nerds (2016)	https://eev.ee/blog/2016/09/15/music-theory-for-nerds/	4	566.5	2266
30370854	Why Segment Went Back to a Monolith	https://www.infoq.com/news/2020/04/microservices-back-again/	3	604	1812
30380861	Fred\'s ImageMagick Scripts	https://www.fmwconcepts.com/imagemagick/index.php	3	1149	3447
30384191	The Day AppGet Died	https://keivan.io/the-day-appget-died/	4	1078.5	4314
30389591	Choose Boring Technology (2015)	https://mcfunley.com/choose-boring-technology	5	459	2295
30430041	Things you notice when you quit the news (2016)	https://www.raptitude.com/2016/12/five-things-you-notice-when-you-quit-the-news/	5	891	4455
30441847	Radio Garden – Explore live radio by rotating the globe	https://radio.garden	4	461	1844
30458167	Elevator.js – A “back to top” button that behaves like a real elevator	https://tholman.com/elevator.js/	4	578.5	2314
30482832	Google users locked out after 15 years\' use	https://www.businessinsider.com/google-users-locked-out-after-years-2020-10	3	1087	3261
30528205	Degoogle: Cutting Google out of your life	https://degoogle.jmoore.dev/	4	705	2820
30546995	How “latency numbers everybody should know” decreased from 1990–2020	https://colin-scott.github.io/personal_website/research/interactive_latency.html	3	611	1833
30598849	A Great Old-Timey Game-Programming Hack (2013)	https://blog.moertel.com/posts/2013-12-14-great-old-timey-game-programming-hack.html	7	252	1764
30689024	Go 1.18	https://go.dev/blog/go1.18	3	773	2319
30765546	Google Maps Hacks	https://www.simonweckert.com/googlemapshacks.html	3	1410	4230
30794308	Reddit\'s website uses DRM for fingerprinting	https://smitop.com/post/reddit-whiteops/	3	1099	3297
30843380	The sad state of sysadmin in the age of containers (2015)	https://www.vitavonni.de/blog/201503/2015031201-the-sad-state-of-sysadmin-in-the-age-of-containers.html	7	428	2996
30856968	Filing taxes could be free & simple. H&R Block & Intuit lobby against it (2017)	https://www.propublica.org/article/filing-taxes-could-be-free-simple-hr-block-intuit-lobbying-against-it	5	509	2545
30866244	An Intuitive Guide to Linear Algebra (2012)	https://betterexplained.com/articles/linear-algebra-guide/	7	285	1995
30908084	What I learned as a hired consultant to autodidact physicists (2016)	https://aeon.co/ideas/what-i-learned-as-a-hired-consultant-for-autodidact-physicists	4	664	2656
30941053	I thought I would have accomplished a lot more today and also before I was 35	https://www.newyorker.com/humor/daily-shouts/i-thought-i-would-have-accomplished-a-lot-more-today-and-also-by-the-time-i-was-thirty-five	4	991.5	3966
31006003	Eden	https://github.com/facebookexperimental/eden	3	624	1872
31049883	CRDTs are the future	https://josephg.com/blog/crdts-are-the-future/	3	1181	3543
31075261	A man owns the most advanced private air force after buying 46 F/A-18s	https://www.thedrive.com/the-war-zone/32869/this-man-owns-the-worlds-most-advanced-private-air-force-after-buying-46-f-a-18-hornets	3	652	1956
31075622	Overhauling Mario 64\'s code to reach 30 FPS and render 6x faster on N64 [video]	https://www.youtube.com/watch?v=t_rzYnXEQlE	3	699	2097
31085385	I Just Hit $100k/year On GitHub Sponsors	https://calebporzio.com/i-just-hit-dollar-100000yr-on-github-sponsors-heres-how-i-did-it	3	1469	4407
31180816	I prepared for a decade to graduate in CS in three months	https://miguelrochefort.com/blog/cs-degree/	4	447.5	1790
31240185	Single Page Applications using Rust	https://www.sheshbabu.com/posts/rust-wasm-yew-single-page-application/	3	886	2658
31273802	7GUIs	https://eugenkiss.github.io/7guis/tasks/	4	630	2520
31279526	Abletone Learning Synth	https://learningsynths.ableton.com/	4	605	2420
31301777	Donald Knuth was framed	https://buttondown.email/hillelwayne/archive/donald-knuth-was-framed/	4	495	1980
31336396	Understanding the bin, sbin, usr/bin, usr/sbin split (2010)	https://lists.busybox.net/pipermail/busybox/2010-December/074114.html	7	534	3738
31390742	A Modern JavaScript Tutorial	https://javascript.info/	4	715.5	2862
31521413	Google: Bing Is Cheating, Copying Our Search Results	https://searchengineland.com/google-bing-is-cheating-copying-our-search-results-62914	3	684	2052
31525290	AWS services explained in one line each	https://adayinthelifeof.nl/2020/05/20/aws.html	3	1668	5004
31534936	GitTorrent: A Decentralized GitHub (2015)	https://blog.printf.net/articles/2015/05/29/announcing-gittorrent-a-decentralized-github/	6	358	2148
31538630	Blocklist of all Facebook domains (2016)	https://github.com/jmdugan/blocklists/blob/master/corporations/facebook/all	5	499	2495
31543584	Advanced Data Structures (2017)	https://courses.csail.mit.edu/6.851/fall17/	3	1176	3528
31559065	Explain Shell	https://explainshell.com/	7	329	2303
31564711	"DigitalOcean Killed Our Company"	https://twitter.com/w3Nicolas/status/1134529316904153089	3	1343	4029
31604932	VSCodium – Free/Libre Open Source Software Binaries of VS Code	https://vscodium.com/	3	723	2169
31627181	The decline of the family has unleashed an epidemic of loneliness	https://www.city-journal.org/decline-of-family-loneliness-epidemic	3	1329	3987
31628342	One Guy Ruined Hacktoberfest 2020	https://joel.net/how-one-guy-ruined-hacktoberfest2020-drama	4	501	2004
31636812	Absolute truths I unlearned as junior developer (2019)	https://monicalent.com/blog/2019/06/03/absolute-truths-unlearned-as-junior-developer/	4	995	3980
31641014	The Power of Prolog	https://www.metalevel.at/prolog	6	348	2088
31647181	Tools for Better Thinking	https://untools.co	4	973.5	3894
31664203	I quit the tech industry (2015)	https://eev.ee/blog/2015/06/09/i-quit-the-tech-industry/	4	591	2364
31702825	MIT Ends Elsevier Negotiations	https://news.mit.edu/2020/guided-by-open-access-principles-mit-ends-elsevier-negotiations-0611	3	1104	3312
31703087	A Facebook crawler was making 7M requests per day to my stupid website	https://coding.napolux.com/a-facebook-crawler-was-making-7m-requests-per-day-to-my-stupid-website/	3	1074	3222
31703394	Activists rally to save Internet Archive as lawsuit threatens site	https://decrypt.co/31906/activists-rally-save-internet-archive-lawsuit-threatens	3	822	2466
31738026	Sega Saturn CD Cracked after 20 Years	https://www.youtube.com/watch?v=jOyfZex7B3E	4	629.5	2518
31778490	GNOME has no thumbnails in the file picker and my toilets are blocked	https://jayfax.neocities.org/mediocrity/gnome-has-no-thumbnails-in-the-file-picker.html	4	935	3740
31801093	Webcams aren\'t good enough	https://reincubate.com/support/how-to/why-are-webcams-bad/	3	704	2112
31805431	0.30000000000000004	https://0.30000000000000004.com/	6	456.5	2739
31828509	How an Alzheimer’s ‘cabal’ thwarted progress toward a cure	https://www.statnews.com/2019/06/25/alzheimers-cabal-thwarted-progress-toward-cure/	3	633	1899
31830046	OBS Studio: Open-source software for video recording and live streaming	https://obsproject.com/	4	1093.5	4374
31837115	Tailscale SSH	https://tailscale.com/blog/tailscale-ssh/	3	759	2277
31841784	The Brave web browser is hijacking links, and inserting affiliate codes	https://davidgerard.co.uk/blockchain/2020/06/06/the-brave-web-browser-is-hijacking-links-and-inserting-affiliate-codes/	3	592	1776
31863966	Goodbye Zachtronics	https://kotaku.com/zachtronics-farewell-goodbye-closing-eliza-last-call-bb-1849096767	3	752	2256
31932349	Coinbase is reportedly selling geolocation data to ICE	https://theintercept.com/2022/06/29/crypto-coinbase-tracer-ice/	3	769	2307
31943531	Visualizing Algorithms (2014)	https://bost.ocks.org/mike/algorithms/	7	294	2058
31961239	The Bullshit Web	https://pxlnv.com/blog/bullshit-web/	3	1017	3051
31981486	On the Use of a Life	https://www.daemonology.net/blog/2020-09-20-On-the-use-of-a-life.html	3	1275	3825
31999259	Why isn\'t the internet more fun and weird? (2019)	https://jarredsumner.com/codeblog/	4	914.5	3658
32034409	Algorithms for Decision Making	https://algorithmsbook.com/	3	693	2079
32127363	Show HN: Bear – Minimal blogging platform	https://bearblog.dev	4	490.5	1962
32188563	Why Taxpayers Pay McKinsey $3M a Year for a Recent College Graduate Contractor	https://mattstoller.substack.com/p/why-taxpayers-pay-mckinsey-3m-a-year	3	781	2343
32213468	Why GNU grep is Fast	https://lists.freebsd.org/pipermail/freebsd-current/2010-August/019310.html	13	417	5421
32217257	Foundations of Databases (1995)	https://webdam.inria.fr/Alice/	4	457.5	1830
32245146	Facebook\'s TikTok-like redesign marks sunset of social networking era	https://www.axios.com/2022/07/25/sunset-social-network-facebook-tiktok	3	683	2049
32279897	Page Weight Matters (2012)	https://blog.chriszacharias.com/page-weight-matters	6	346.5	2079
32303786	“You want to know something about how bullshit insane our brains are?” (2018)	https://twitter.com/Foone/status/1014267515696922624	4	472	1888
32339424	Who Americans spend their time with, by age	https://ourworldindata.org/time-with-others-lifetime	3	642	1926
32350462	We\'re improving search results when you use quotes	https://blog.google/products/search/how-were-improving-search-results-when-you-use-quotes/	3	741	2223
32392793	Software Architecture Is Overrated, Clear and Simple Design Is Underrated	https://blog.pragmaticengineer.com/software-architecture-is-overrated/	3	608	1824
32507843	Learn to sew your own outdoor gear	https://learnmyog.com/	3	748	2244
32513020	Whytheluckystiff\'s original domain back as an archive	https://whytheluckystiff.net/	7	387	2709
32520882	How to Turn an IKEA Coffee Table into a DIY Server Rack	https://wiki.eth0.nl/index.php/LackRack	6	347	2082
32595589	Removal of Heroku free product plans	https://help.heroku.com/RSBRUH58/removal-of-heroku-free-product-plans-faq	3	908	2724
32601899	SpaceX, T-Mobile to connect satellites to cellphones in remote areas	https://www.wsj.com/articles/spacex-and-t-mobile-to-connect-starlink-satellites-to-cellphones-in-remote-parts-of-u-s-11661473520	3	621	1863
32636760	Stable Diffusion is a big deal	https://simonwillison.net/2022/Aug/29/stable-diffusion/	3	874	2622
32707543	Turns out half the internet has a single-point-of-failure called “Cloudflare”	https://easydns.com/blog/2020/07/20/turns-out-half-the-internet-has-a-single-point-of-failure-called-cloudflare/	3	972	2916
32728827	How Big Oil Misled the Public into Believing Plastic Would Be Recycled	https://www.npr.org/2020/09/11/897692090/how-big-oil-misled-the-public-into-believing-plastic-would-be-recycled	3	687	2061
32776276	What\'s SAP?	https://retool.com/blog/erp-for-engineers/	4	1088	4352
32799872	Atkinson Hyperlegible Font	https://brailleinstitute.org/freefont	3	799	2397
32822366	Not everyone has an internal monologue	https://ryanandrewlangdon.wordpress.com/2020/01/28/today-i-learned-that-not-everyone-has-an-internal-monologue-and-it-has-ruined-my-day/	3	1225	3675
32831673	What Gödel Discovered	https://stopa.io/post/269	3	1000	3000
32894344	MacOS Catalina: Slow by Design?	https://sigpipe.macromates.com/2020/macos-catalina-slow-by-design/	3	2031	6093
32913125	Learn how to unleash the full potential of the type system of TypeScript	https://type-level-typescript.com/	3	589	1767
32944928	An incomplete list of skills senior engineers need, beyond coding	https://skamille.medium.com/an-incomplete-list-of-skills-senior-engineers-need-beyond-coding-8ed4a521b29f	3	821	2463
32968597	This page is a truly naked, brutalist HTML quine	https://secretgeek.github.io/html_wysiwyg/html.html	5	633	3165
33019951	Acing the technical interview	https://aphyr.com/posts/340-acing-the-technical-interview	3	825	2475
33034351	Select * from cloud	https://steampipe.io/	3	790	2370
33082128	Knuth\'s Art of Computer Programming, V 4B, has gone into print	https://www-cs-faculty.stanford.edu/~knuth/news.html#v4b	3	940	2820
33127285	I Made a Self-Quoting Tweet	https://oisinmoran.com/quinetweet	3	622	1866
33130224	Lessons learned building an ML trading system	https://www.tradientblog.com/2019/11/lessons-learned-building-an-ml-trading-system-that-turned-5k-into-200k/	3	914	2742
33151402	Ray tracing in notepad.exe at 30 FPS	https://kylehalladay.com/blog/2020/05/20/Rendering-With-Notepad.html	4	543	2172
33166054	Aerc – a pretty good (terminal) email client	https://aerc-mail.org/	4	463.5	1854
33224542	Compiler Explorer	https://godbolt.org/	6	541	3246
33259289	Forgotten Employee (2002)	https://sites.google.com/site/forgottenemployee/	5	520	2600
33277926	Thelio – System76	https://system76.com/desktops	3	684	2052
33287518	People Staring at Computers	https://kylemcdonald.net/psac/	3	743	2229
33311110	Dotfile madness (2019)	https://0x46.net/thoughts/2019/02/01/dotfile-madness/	4	669	2676
33317169	The first rule of Microsoft Excel: Don’t tell anyone you’re good at it	https://www.wsj.com/articles/the-first-rule-of-microsoft-exceldont-tell-anyone-youre-good-at-it-1538754380	4	482	1928
33330864	My dad\'s resume and skills from 1980	https://github.com/runvnc/dadsresume	4	1148	4592
