# id	title	url	count	median_score	popularity
38735066	From Nand to Tetris (2017)	https://www.nand2tetris.org	3	667	2001
38778390	Apollo 11 vs. USB-C Chargers (2020)	https://forrestheller.com/Apollo-11-Computer-vs-USB-C-chargers.html	4	449.5	1798
38796078	After self-hosting my email for twenty-three years I have thrown in the towel	https://cfenollosa.com/blog/after-self-hosting-my-email-for-twenty-three-years-i-have-thrown-in-the-towel-the-oligopoly-has-won.html	4	974	3896
38802086	Ideal Monitor Rotation for Programmers	https://sprocketfox.io/xssfox/2021/12/02/xrandr/	4	685.5	2742
38806270	In 2024, please switch to Firefox	https://roytanck.com/2023/12/23/in-2024-please-switch-to-firefox/	3	1776	5328
38809485	Tracking developer build times to decide if the M3 MacBook is worth upgrading	https://incident.io/blog/festive-macbooks	3	653	1959
38809642	Most-favorited Hacker News posts	https://observablehq.com/@tomlarkworthy/hacker-favourites-analysis	3	1266	3798
38823445	A future for SQL on the web	https://jlongster.com/future-sql-web	4	502.5	2010
38831219	Standard Ebooks	https://standardebooks.org/	8	701	5608
38851740	Uutils: an attempt at writing cross-platform CLI utilities in Rust	https://github.com/uutils/coreutils	7	302	2114
38877423	An app can be a home-cooked meal	https://www.robinsloan.com/notes/home-cooked-app/	6	556	3336
38899290	DNS Toys	https://www.dns.toys/	5	490	2450
38913425	Dive: A tool for exploring a Docker image, layer contents and more	https://github.com/wagoodman/dive	4	464	1856
38917175	The curious case of the Raspberry Pi in the network closet (2019)	https://blog.haschek.at/2019/the-curious-case-of-the-RasPi-in-our-network.html	4	564	2256
38921237	How I cut GTA Online loading times by 70%	https://nee.lv/2021/02/28/How-I-cut-GTA-Online-loading-times-by-70/	5	476	2380
38925277	Soft deletion probably isn\'t worth it	https://brandur.org/soft-deletion	3	654	1962
38931559	Contra Wirecutter on the IKEA air purifier	https://dynomight.net/ikea-purifier/	4	978.5	3914
38932603	WikiHouse – Open source, modular, wood based, zero carbon housing	https://www.wikihouse.cc/	4	499.5	1998
38953618	Outlook is Microsoft\'s new data collection service	https://proton.me/blog/outlook-is-microsofts-new-data-collection-service	3	688	2064
39021946	30 years later, QBasic is still the best	https://www.nicolasbize.com/blog/30-years-later-qbasic-is-still-the-best/	6	373	2238
39034160	Which word begins with "y" and looks like an axe in this picture? (2017)	https://english.stackexchange.com/questions/395382/which-word-begins-with-y-and-looks-like-an-axe-in-this-picture	5	615	3075
39084137	Flipper Zero – Portable Multi-Tool Device for Geeks	https://flipperzero.one	4	820.5	3282
39109327	Beirut Port Explosion	https://forensic-architecture.org/investigation/beirut-port-explosion	4	679	2716
39127433	Only 90s Web Developers Remember This (2014)	https://zachholman.com/posts/only-90s-developers/	5	628	3140
39136472	Command-line Tools can be 235x Faster than your Hadoop Cluster (2014)	https://adamdrake.com/command-line-tools-can-be-235x-faster-than-your-hadoop-cluster.html	7	362	2534
39142748	Oasis: a small statically-linked Linux system	https://github.com/oasislinux/oasis	6	381	2286
39156778	Implementing a ChatGPT-like LLM from scratch, step by step	https://github.com/rasbt/LLMs-from-scratch	3	739	2217
39163094	Anki – Powerful, intelligent flash cards	https://apps.ankiweb.net/	4	588	2352
39178886	Meta AI releases Code Llama 70B	https://twitter.com/AIatMeta/status/1752013879532782075	3	598	1794
39188030	Starbucks and TrustArc add fake cookie processing delay if you don\'t click agree	https://twitter.com/pixelscript/status/1436664488913215490	3	668	2004
39209687	Generating Fantasy Maps (2016)	https://mewo2.com/notes/terrain/	4	589.5	2358
39217149	My favourite Git commit (2019)	https://dhwthompson.com/2019/my-favourite-git-commit	3	714	2142
39219761	CyberChef – Cyber Swiss Army Knife	https://gchq.github.io/CyberChef/	8	393	3144
39273932	CLI Guidelines – A guide to help you write better command-line programs	https://clig.dev/	9	341	3069
39294921	The new hire who showed up is not the same person we interviewed	https://www.askamanager.org/2022/01/the-new-hire-who-showed-up-is-not-the-same-person-we-interviewed.html	3	1018	3054
39313623	Almost every infrastructure decision I endorse or regret	https://cep.dev/posts/every-infrastructure-decision-i-endorse-or-regret-after-4-years-running-infrastructure-at-a-startup/	3	1181	3543
39374020	Inside the proton, the ‘most complicated thing you could possibly imagine’	https://www.quantamagazine.org/inside-the-proton-the-most-complicated-thing-imaginable-20221019/	3	612	1836
39400415	I regret my website redesign	https://mtlynch.io/tinypilot-redesign/	4	1034.5	4138
39421090	Lapce – Fast open-source code editor	https://lapce.dev/	4	531	2124
39428880	Groq	https://groq.com/	5	847	4235
39440179	In defense of simple architectures	https://danluu.com/simple-architectures/	4	479	1916
39443679	SSDs have become fast, except in the cloud	https://databasearchitects.blogspot.com/2024/02/ssds-have-become-ridiculously-fast.html	3	589	1767
39451016	Game Programming Patterns (2014)	https://gameprogrammingpatterns.com/	12	203.5	2442
39452543	Pijul: A intuitive VCS unlike Git that\'s based on sound theory of patches	https://pijul.org/	8	255	2040
39472693	Nobody ever gets credit for fixing problems that never happened (2001) [pdf]	https://web.mit.edu/nelsonr/www/Repenning=Sterman_CMR_su01_.pdf	3	1031	3093
39506420	PID Without a PhD (2016) [pdf]	https://www.wescottdesign.com/articles/pid/pidWithoutAPhd.pdf	6	301	1806
39511676	Apache Superset	https://superset.apache.org/	3	696	2088
39522640	Sandspiel	https://sandspiel.club/	4	677.5	2710
39532650	GoboLinux	https://www.gobolinux.org/	7	283	1981
39569843	Please don\'t use Discord for FOSS projects	https://drewdevault.com/2021/12/28/Dont-use-Discord-for-FOSS.html	4	440	1760
39570692	Ente – Privacy friendly alternative to Google Photos	https://ente.io/	5	964	4820
39581358	Music for Programming (2011)	https://musicforprogramming.net/	10	427	4270
39590666	Claude 3 model family	https://www.anthropic.com/news/claude-3-family	3	1016	3048
39604746	Meta outage	https://metastatus.com/	3	698	2094
39623128	Bob Cassette Rewinder: Hacking Detergent DRM	https://github.com/dekuNukem/bob_cassette_rewinder	4	872	3488
39629044	Eloquent JavaScript 4th edition (2024)	https://eloquentjavascript.net/	7	632	4424
39637494	Akira Toriyama has died	https://noisypixel.net/dragon-ball-creator-akira-toriyama-has-passed-away/	3	1065	3195
39637587	Puter	https://puter.com/	4	447.5	1790
39700256	Spreadsheets are all you need	https://spreadsheets-are-all-you-need.ai/index.html	3	1493	4479
39714761	Vision Pro: What we got wrong at Oculus that Apple got right	https://hugo.blog/2024/03/11/vision-pro/	3	873	2619
39738609	CS 168: The Modern Algorithmic Toolbox	https://web.stanford.edu/class/cs168/index.html	3	589	1767
39742578	Dear Paul Graham, there is no cookie banner law	https://www.amazingcto.com/cookie-banners-are-not-needed/	3	607	1821
39761419	Htmlq: like jq, but for html	https://github.com/mgdm/htmlq	3	961	2883
39768860	Suspicious Discontinuities	https://danluu.com/discontinuities/	5	525	2625
39795090	Atlassian fired me while I was taking care of my wife who is fighting cancer	https://shitlassian.com/	3	1426	4278
39799755	Recursive Game of Life	https://oimo.io/works/life/	5	1072	5360
39810378	Monolith – CLI tool for saving complete web pages as a single HTML file	https://github.com/Y2Z/monolith	3	772	2316
39813067	The best engineering interview question I\'ve ever gotten	https://quuxplusone.github.io/blog/2022/01/06/memcached-interview/	4	539.5	2158
39814690	Commission opens non-compliance investigations against Alphabet, Apple and Meta	https://ec.europa.eu/commission/presscorner/detail/en/ip_24_1689	3	579	1737
39827266	Baltimore\'s Key Bridge struck by cargo ship, collapses	https://www.wbaltv.com/article/baltimore-bridge-collapse-key-bridge/60303975	3	712	2136
39840286	Daniel Kahneman has died	https://www.washingtonpost.com/obituaries/2024/03/27/daniel-kahneman-dead/	3	1002	3006
39852953	Sam Bankman-Fried sentenced to 25 years in prison	https://www.cnn.com/business/live-news/sam-bankman-fried-sentencing-03-28-24/index.html	3	1267	3801
39854182	NotepadNext: A cross-platform reimplementation of Notepad++	https://github.com/dail8859/NotepadNext	4	453.5	1814
39856413	What Boeing did to all the guys who remember how to build a plane	https://prospect.org/infrastructure/transportation/2024-03-28-suicide-mission-boeing/	3	866	2598
39858750	DOOM Captcha	https://vivirenremoto.github.io/doomcaptcha/	4	570.5	2282
39865810	Backdoor in upstream xz/liblzma leading to SSH server compromise	https://www.openwall.com/lists/oss-security/2024/03/29/4	3	4543	13629
39877267	XZ backdoor: "It\'s RCE, not auth bypass, and gated/unreplayable."	https://bsky.app/profile/filippo.abyssdomain.expert/post/3kowjkx2njy2b	3	1323	3969
39882289	Xz: A microcosm of the interactions in open source projects	https://robmensching.com/blog/posts/2024/03/30/a-microcosm-of-the-interactions-in-open-source-projects/	4	524.5	2098
39890262	LLaMA now goes faster on CPUs	https://justine.lol/matmul/	3	1370	4110
39895344	Xzbot: Notes, honeypot, and exploit demo for the xz backdoor	https://github.com/amlweems/xzbot	3	845	2535
39896371	The Wi-Fi only works when it\'s raining	https://predr.ag/blog/wifi-only-works-when-its-raining/	3	1140	3420
39902241	Timeline of the xz open source attack	https://research.swtch.com/xz-timeline	3	1059	3177
39903685	The xz attack shell script	https://research.swtch.com/xz-script	3	603	1809
39913616	Subroutine calls in the ancient world, before computers had stacks or heaps	https://devblogs.microsoft.com/oldnewthing/20240401-00/?p=109599	4	469.5	1878
39919401	Tips for linking shell companies to their secret owners	https://gijn.org/stories/tracking-shell-companies-secret-owners/	3	1064	3192
39923212	How a Kalman filter works, in pictures	https://www.bzarg.com/p/how-a-kalman-filter-works-in-pictures/	8	301.5	2412
39923404	Show HN: I\'ve built a locally running Perplexity clone	https://github.com/nilsherzig/LLocalSearch	3	660	1980
39928604	Anatomy of a credit card rewards program	https://www.bitsaboutmoney.com/archive/anatomy-of-credit-card-rewards-programs/	5	1178	5890
39930463	AI-generated sad girl with piano performs the text of the MIT License	https://twitter.com/goodside/status/1775713487529922702	3	667	2001
39936246	Mario meets Pareto	https://www.mayerowitz.io/blog/mario-meets-pareto	3	1539	4617
39970115	Rental Camera Gear Destroyed by the Solar Eclipse of 2017 (2017)	https://www.lensrentals.com/blog/2017/09/rental-camera-gear-destroyed-by-the-solar-eclipse-of-2017/	3	599	1797
40008383	Show HN: DNS over Wikipedia	https://github.com/aaronjanse/dns-over-wikipedia	5	398	1990
40047041	BTFS – mount any .torrent file or magnet link as directory	https://github.com/johang/btfs	5	386	1930
40095523	Cameras and Lenses	https://ciechanow.ski/cameras-and-lenses/	4	1074	4296
40101885	I bought 300 emoji domain names from Kazakhstan and built an email service	https://tinyprojects.dev/projects/mailoji	3	1683	5049
40103590	I should have loved biology	https://jsomers.net/i-should-have-loved-biology/	5	800	4000
40159766	The smallest and worst HDMI display	https://mitxela.com/projects/ddc-oled	3	969	2907
40161697	Start Your Own ISP	https://startyourownisp.com/	5	607	3035
40177599	HTML5 Genetic Cars	https://rednuht.org/genetic_cars_2/	5	484	2420
40211583	The amazing $1 microcontroller (2017)	https://jaycarlson.net/microcontrollers/	8	332	2656
40242410	A Single Div	https://a.singlediv.com/	5	535	2675
40280490	Can I Email: ‘Can I Use’ for email	https://www.caniemail.com/	5	682	3410
40280726	Why Enterprise Software Sucks	https://twitter.com/random_walker/status/1182635589604171776	3	1310	3930
40328935	Serving Netflix Video at 400Gb/s on FreeBSD [pdf]	https://people.freebsd.org/~gallatin/talks/euro2021.pdf	3	707	2121
40329388	Immersive Linear Algebra – A free interactive online book	https://immersivemath.com/ila/index.html	8	945.5	7564
40363262	Big Company vs. Startup Work and Compensation	https://danluu.com/startup-tradeoffs/	3	730	2190
40378114	Visual design rules you can safely follow	https://anthonyhobday.com/sideprojects/saferules/	3	1978	5934
40379532	How to grow sodium chloride crystals at home	https://crystalverse.com/sodium-chloride-crystals/	3	1119	3357
40379833	Ubershaders: A Ridiculous Solution to an Impossible Problem	https://dolphin-emu.org/blog/2017/07/30/ubershaders/	3	772	2316
40400648	Ever-expanding animation of the life of the 796th floor of a space station	https://floor796.com/	3	776	2328
40403115	How to Exit Vim	https://github.com/hakluke/how-to-exit-vim/blob/master/README.md	4	587.5	2350
40487068	Helix: a post-modern modal text editor	https://helix-editor.com/	5	363	1815
40488844	Big data is dead	https://motherduck.com/blog/big-data-is-dead/	3	879	2637
40524531	How some good corporate engineering blogs are written	https://danluu.com/corp-eng-blogs/	3	617	1851
40540952	Show HN: Wired-elements – UI web components with a hand drawn, sketchy look	https://wiredjs.com/	3	650	1950
40553986	Show HN: I\'m a doctor and made a responsive breathing app for stress and anxiety	https://www.lungy.app/	3	666	1998
40588639	Employees That Stay In Companies Longer Get Paid Less	https://www.forbes.com/sites/cameronkeng/2014/06/22/employees-that-stay-in-companies-longer-than-2-years-get-paid-50-less/	5	437	2185
40617086	Screw it, I’ll host it myself	https://www.markozivanovic.com/screw-it-ill-host-it-myself/	3	1019	3057
40620472	Draw an iceberg and see how it would float in water	https://joshdata.me/iceberger.html	3	1669	5007
40642871	NanoGPT	https://github.com/karpathy/nanoGPT	3	1532	4596
40657371	Ideal OS: Rebooting the Desktop Operating System	https://joshondesign.com/2017/08/18/idealos_essay	3	656	1968
40681306	H.264 is Magic (2016)	https://sidbala.com/h-264-is-magic/	9	714	6426
40693214	Bullshit.js	https://mourner.github.io/bullshit.js/	3	688	2064
40694103	The architecture behind a one-person tech startup	https://anthonynsimon.com/blog/one-man-saas-architecture/	3	1330	3990
40708581	Building a Virtual Machine Inside ChatGPT	https://www.engraved.blog/building-a-virtual-machine-inside/	3	2029	6087
40718566	What is ChatGPT doing and why does it work?	https://writings.stephenwolfram.com/2023/02/what-is-chatgpt-doing-and-why-does-it-work/	3	1090	3270
40769362	Start all of your commands with a comma (2009)	https://rhodesmill.org/brandon/2009/commands-with-comma/	5	411	2055
40802066	I Add 3-25 Seconds of Latency to Every Site I Visit	https://howonlee.github.io/2020/02/12/I-20Add-2020-20Seconds-20of-20Latency-20to-20Every-20Website-20I-20Visit.html	3	1564	4692
40828493	ImHex – A Hex Editor	https://github.com/WerWolv/ImHex	5	467	2335
40862144	Show HN: Sublime Merge – A Git client from the makers of Sublime Text	https://www.sublimemerge.com	3	935	2805
40892259	Why privacy is important, and having “nothing to hide” is irrelevant	https://robindoherty.com/2016/01/06/nothing-to-hide.html	3	697	2091
40950235	Crafting Interpreters is available in print	https://craftinginterpreters.com/	5	607	3035
40962965	Just Be Rich	https://keenen.xyz/just-be-rich/	3	1875	5625
41023547	What rr does	https://rr-project.org/	8	274	2192
41031585	Parse, Don’t Validate	https://lexi-lambda.github.io/blog/2019/11/05/parse-don-t-validate/	8	393.5	3148
41079264	Lionel Messi Is Impossible (2014)	https://fivethirtyeight.com/features/lionel-messi-is-impossible/	5	374	1870
41083972	Linux Kernel Module Programming Guide	https://sysprog21.github.io/lkmpg/	5	386	1930
41116473	macOS in QEMU in Docker	https://github.com/sickcodes/Docker-OSX	7	458	3206
41200660	An old hacker\'s tips on staying employed	https://madned.substack.com/p/an-old-hackers-tips-on-staying-employed	3	815	2445
41209688	OpenSnitch is a GNU/Linux port of the Little Snitch application firewall	https://github.com/evilsocket/opensnitch	6	363.5	2181
41214180	The Gervais Principle, or the Office According to “The Office” (2009)	https://www.ribbonfarm.com/2009/10/07/the-gervais-principle-or-the-office-according-to-the-office/	9	258	2322
41224260	A UX designer walks into a Tesla Bar	https://jenson.org/tesla/	3	906	2718
41266342	The Untold Story of SQLite	https://corecursive.com/066-sqlite-with-richard-hipp/	6	295	1770
41274932	I read the federal government’s Zero-Trust Memo so you don’t have to	https://www.bastionzero.com/blog/i-read-the-federal-governments-zero-trust-memo-so-you-dont-have-to	3	656	1968
41281152	Syncthing – a continuous file synchronization program	https://syncthing.net/	10	313	3130
41289114	Parsing Protobuf at 2+GB/S: How I Learned to Love Tail Calls in C	https://blog.reverberate.org/2021/04/21/musttail-efficient-interpreters.html	3	586	1758
41348149	Facebook banned me for life because I help people use it less	https://slate.com/technology/2021/10/facebook-unfollow-everything-cease-desist.html	3	620	1860
41384118	Twenty years of Valgrind	https://nnethercote.github.io/2022/07/27/twenty-years-of-valgrind.html	3	626	1878
41404064	Password protect a static HTML page	https://github.com/robinmoisson/staticrypt	3	653	1959
41406502	You\'ve only added two lines – why did that take two days?	https://www.mrlacey.com/2020/07/youve-only-added-two-lines-why-did-that.html	3	964	2892
41427185	Notes on Distributed Systems for Young Bloods (2013)	https://www.somethingsimilar.com/2013/01/14/notes-on-distributed-systems-for-young-bloods/	8	346	2768
41448022	Dynamicland	https://dynamicland.org/	8	297	2376
41501215	Sapling: A new source control system with Git-compatible client	https://engineering.fb.com/2022/11/15/open-source/sapling-source-control-scalable/	3	926	2778
41507188	Room 641A	https://en.wikipedia.org/wiki/Room_641A	8	227.5	1820
41508593	September 11, 2001 media synced in real-time	https://911realtime.org/	3	788	2364
41549122	The unreasonable effectiveness of simple HTML	https://shkspr.mobi/blog/2021/01/the-unreasonable-effectiveness-of-simple-html/	4	556	2224
41550603	Plain Text Accounting	https://plaintextaccounting.org/	9	290	2610
41558668	Monolith First (2015)	https://martinfowler.com/bliki/MonolithFirst.html	4	484.5	1938
41585156	Comic Mono	https://dtinth.github.io/comic-mono-font/	5	643	3215
41630223	Nova by Panic	https://nova.app/	3	1051	3153
41663129	Cello – High Level C	https://libcello.org/	10	271	2710
41688966	This shouldn\'t have happened: A vulnerability postmortem	https://googleprojectzero.blogspot.com/2021/12/this-shouldnt-have-happened.html	3	938	2814
41695800	Your Computer Isn\'t Yours	https://sneak.berlin/20201112/your-computer-isnt-yours/	3	1514	4542
41701156	MusicBrainz: An open music encyclopedia (2017)	https://musicbrainz.org/	5	432	2160
41736903	Why does man print “gimme gimme gimme” at 00:30? (2017)	https://unix.stackexchange.com/questions/405783/why-does-man-print-gimme-gimme-gimme-at-0030	5	560	2800
41765022	In MySQL, use “utf8mb4” instead of “utf8” (2016)	https://adamhooper.medium.com/in-mysql-never-use-utf8-use-utf8mb4-11761243e434	3	643	1929
41829913	Restic – Backups Done Right	https://restic.net/	5	573	2865
41863975	uBlock Origin works best on Firefox	https://github.com/gorhill/uBlock/wiki/uBlock-Origin-works-best-on-Firefox	4	438	1752
41916574	Mining Bitcoin with pencil and paper: 0.67 hashes per day (2014)	https://www.righto.com/2014/09/mining-bitcoin-with-pencil-and-paper.html	5	404	2020
41946534	How not to sort by average rating (2009)	https://www.evanmiller.org/how-not-to-sort-by-average-rating.html	9	195	1755
41962750	50 Years Ago, Sugar Industry Quietly Paid Scientists to Blame Fat (2016)	https://www.npr.org/sections/thetwo-way/2016/09/13/493739074/50-years-ago-sugar-industry-quietly-paid-scientists-to-point-blame-at-fat	5	645	3225
41968409	Write code that is easy to delete, not easy to extend (2016)	https://programmingisterrible.com/post/139222674273/write-code-that-is-easy-to-delete-not-easy-to	5	365	1825
41993662	Astral	https://astral.sh/	3	1078	3234
42056918	98.css – A design system for building faithful recreations of old UIs	https://jdan.github.io/98.css/	3	606	1818
42067148	The truffle industry is a scam	https://www.tasteatlas.com/truffle-industry-is-a-big-scam	3	585	1755
42079186	Actually Portable Executable	https://justine.lol/ape.html	3	644	1932
42090430	Why I Quit Google to Work for Myself	https://mtlynch.io/why-i-quit-google/	4	1074	4296
42097160	UnifiedPush: A decentralized, open-source push notification protocol	https://f-droid.org/2022/12/18/unifiedpush.html	3	741	2223
42100499	ASCII Delimited Text – Not CSV or TAB delimited text	https://ronaldduncan.wordpress.com/2009/10/31/text-file-formats-ascii-delimited-text-not-csv-or-tab-delimited-text/	3	695	2085
42114051	Dev Fonts	https://devfonts.gafi.dev/	3	642	1926
42143269	Relativty  – An open-source VR headset	https://www.relativty.com/	3	819	2457
42156106	Penguin travels every year to visit man who rescued him (2016)	https://www.cbc.ca/news/trending/dindim-o-lindo-pinguim-1.3487668	3	862	2586
42163900	CAN Injection: Keyless car theft	https://kentindell.github.io/2023/04/03/can-injection/	3	610	1830
42186746	The Deep Sea	https://neal.fun/deep-sea/	7	363	2541
42188407	Why is Rosetta 2 fast?	https://dougallj.wordpress.com/2022/11/09/why-is-rosetta-2-fast/	3	650	1950
42224670	Bocker: Docker implemented in around 100 lines of Bash (2015)	https://github.com/p8952/bocker	6	356.5	2139
42243500	Lies we tell ourselves to keep using Golang	https://fasterthanli.me/articles/lies-we-tell-ourselves-to-keep-using-golang	3	748	2244
42290069	1/0 = 0	https://www.hillelwayne.com/post/divide-by-zero/	3	650	1950
42298032	Why Not Mars	https://idlewords.com/2023/1/why_not_mars.htm	3	815	2445
42318516	Awk in 20 Minutes (2015)	https://ferd.ca/awk-in-20-minutes.html	4	633	2532
42354691	Nyxt Browser	https://nyxt.atlas.engineer/	5	533	2665
42366546	Theory-building and why employee churn is lethal to software companies	https://www.baldurbjarnason.com/2022/theory-building/	3	622	1866
42430450	Why is it hard to buy things that work well?	https://danluu.com/nothing-works/	3	848	2544
42448405	GPS	https://ciechanow.ski/gps/	5	414	2070
42450913	Show HN: I spent 2 years building a personal finance simulator	https://projectionlab.com/	3	766	2298
42461688	Kanban board in one HTML using localstorage	https://github.com/apankrat/nullboard	5	400	2000
42481206	City Roads – Draw all roads in a city at once	https://anvaka.github.io/city-roads/	4	569.5	2278
42481659	SingleFile: Save a complete web page into a single HTML file	https://github.com/gildas-lormeau/SingleFile	3	958	2874
42523745	1:60 scale Boeing 777 made from manila folders	https://www.lucaiaconistewart.com/model-777	3	885	2655
42537567	A fun website that simulates fluid	https://paveldogreat.github.io/WebGL-Fluid-Simulation/	6	390	2340
42562156	Production Twitter on one machine? 100Gbps NICs and NVMe are fast	https://thume.ca/2023/01/02/one-machine-twitter/	3	776	2328
42572662	Show HN: Mitmproxy2swagger – Automagically reverse-engineer REST APIs	https://github.com/alufers/mitmproxy2swagger	3	691	2073
42588956	Terrain rendering algorithm in less than 20 lines of code	https://github.com/s-macke/VoxelSpace	6	720	4320
42650954	20 lines of code that beat A/B testing every time	https://stevehanov.ca/blog/index.php?id=132	5	545	2725
42675725	Show HN: Tabby – A self-hosted GitHub Copilot	https://github.com/TabbyML/tabby	3	627	1881
42728916	Oh Shit, Git?	https://ohshitgit.com/	11	412	4532
42779541	Time to Take a Stand	https://blog.samaltman.com/time-to-take-a-stand	3	1131	3393
42787393	IRS records reveal how the wealthiest avoid income tax	https://www.propublica.org/article/the-secret-irs-files-trove-of-never-before-seen-records-reveal-how-the-wealthiest-avoid-income-tax	3	1031	3093
42823667	OpenRA – Classic strategy games rebuilt for the modern era	https://www.openra.net/	4	610	2440
42829346	Drop a raindrop anywhere in the world and watch where it ends up	https://river-runner-global.samlearner.com/	3	790	2370
42835806	A List of Hacker News\'s Undocumented Features and Behaviors (2018-20)	https://github.com/minimaxir/hacker-news-undocumented	8	335	2680
42837462	If OpenSSL were a GUI	https://smallstep.com/blog/if-openssl-were-a-gui/	4	467	1868
42899620	Cosmopolitan Third Edition	https://justine.lol/cosmo3/	3	1205	3615
42911042	Waydroid – Run Android containers on Ubuntu	https://waydro.id/	4	602	2408
42922987	Ask vs. Guess Culture	https://jeanhsu.substack.com/p/ask-vs-guess-culture	3	946	2838
42948703	Embrace the Grind	https://jacobian.org/2021/apr/7/embrace-the-grind/	3	1167	3501
42962329	Supersonic Trebuchet	https://hackaday.com/2021/12/01/supersonic-projectile-exceeds-engineers-dreams-the-supersonic-trebuchet/	3	650	1950
42972062	Asahi Linux lead developer Hector Martin resigns from Linux kernel	https://lkml.org/lkml/2025/2/7/9	3	918	2754
42976698	Do-nothing scripting: the key to gradual automation (2019)	https://blog.danslimmon.com/2019/07/15/do-nothing-scripting-the-key-to-gradual-automation/	5	645	3225
42999561	Advertising Is a Cancer on Society	https://jacek.zlydach.pl/blog/2019-07-31-ads-as-cancer.html	3	692	2076
43007628	The Floppotron 3.0	https://silent.org.pl/home/2022/06/13/the-floppotron-3-0/	3	1398	4194
43027396	USA Facts – Federal, state, and local data from government sources	https://usafacts.org/	3	1044	3132
43087779	Reality has a surprising amount of detail (2017)	https://johnsalvatier.org/blog/2017/reality-has-a-surprising-amount-of-detail	9	397	3573
43155839	Is this the simplest (and most surprising) sorting algorithm?	https://arxiv.org/abs/2110.01111	3	621	1863
43157980	Building a BitTorrent client from the ground up in Go	https://blog.jse.li/posts/torrent/	5	580	2900
