# id	title	url	count	median_score	popularity
3448266	How to nap	https://www.boston.com/bostonglobe/ideas/naps/	3	647	1941
5216192	Heroku\'s Ugly Secret: The story of how the cloud-king turned its back on Rails	https://rapgenius.com/James-somers-herokus-ugly-secret-lyrics	3	1763	5289
5420811	Adria Richards, PyCon, and How We All Lost	https://amandablumwords.wordpress.com/2013/03/21/3/	3	1023	3069
5592679	Tearable Cloth Simulation in JavaScript	https://codepen.io/stuffit/pen/KrAwx	3	1048	3144
5815690	Watch a VC use my name to sell a con	https://www.jwz.org/blog/2011/11/watch-a-vc-use-my-name-to-sell-a-con/	3	2376	7128
6680763	Google Security Team Member on NSA: "Fuck These Guys"	https://plus.google.com/+MikeHearn/posts/LW1DXJ2BK8k	3	1217	3651
6799854	How Hacker News ranking really works: scoring, controversy, and penalties	https://www.righto.com/2013/11/how-hacker-news-ranking-really-works.html	4	531	2124
7069889	OpenBSD will shut down if we do not have the funding to keep the lights on	https://marc.info/?l=openbsd-misc&m=138972987203440&w=2	3	825	2475
7086997	Wozniak: “Actually, the movie was largely a lie about me”	https://plus.google.com/+CarmsPerez/posts/GnVTvQNgvpf	3	1591	4773
7353283	The Face Behind Bitcoin?	https://mag.newsweek.com/2014/03/14/bitcoin-satoshi-nakamoto.html	3	1165	3495
7673643	The Absurdity of LinkedIn	https://blog.42floors.com/absurdity-linkedin/	3	803	2409
7869136	Docker 1.0	https://blog.docker.com/2014/06/its-here-docker-1-0/	3	709	2127
8015468	Satya Nadella – Microsoft\'s CEO	https://www.microsoft.com/en-us/news/ceo/index.html	3	1023	3069
8583722	President Obama Calls for a Free and Open Internet	https://www.whitehouse.gov/net-neutrality	3	1219	3657
9028004	High Frequency Dating	https://robrhinehart.com/?p=1005	3	678	2034
9075945	Stripe: Bitcoin	https://stripe.com/bitcoin	3	597	1791
10204018	Show HN: Make a programmable mirror	https://github.com/HannahMitt/HomeMirror	3	1172	3516
10554679	Don\'t Copy-Paste from Website to Terminal	https://thejh.net/misc/website-terminal-copy-paste	3	689	2067
10774865	SpaceX launch webcast: Orbcomm-2 Mission [video]	https://spacex.com/webcast/	3	1284	3852
11004396	Why use www?	https://www.yes-www.org/why-use-www/	4	504.5	2018
11186756	MentalHealthError: an exception occurred	https://www.kennethreitz.org/essays/mentalhealtherror-an-exception-occurred	3	593	1779
11240717	Why I Did Not Go To Jail	https://www.bhorowitz.com/why_i_did_not_go_to_jail	3	580	1740
11313706	Windows NT Kernel Contributor Explains Why Performance is Behind Other OS	https://blog.zorinaq.com/?e=74	3	656	1968
11407958	DuckDuckGo is blowing up	https://duckduckgo.com/traffic.html	5	353	1765
11452765	YouTube-dl: Open-source YouTube downloader	https://rg3.github.io/youtube-dl/	3	989	2967
11572146	Mosh: SSH for 2012	https://mosh.mit.edu/	6	435.5	2613
11609708	Craig Steven Wright claims to be Satoshi Nakamoto	https://www.economist.com/news/briefings/21698061-craig-steven-wright-claims-be-satoshi-nakamoto-bitcoin	3	639	1917
11680013	The NYPD Was Ticketing Legally Parked Cars; Open Data Put an End to It	https://iquantny.tumblr.com/post/144197004989/the-nypd-was-systematically-ticketing-legally	3	868	2604
12360714	NSO Group\'s iPhone Zero-Days used against a UAE Human Rights Defender	https://citizenlab.org/2016/08/million-dollar-dissident-iphone-zero-day-nso-group-uae/	3	1055	3165
12374235	Who\'s downloading pirated papers? Everyone	https://www.sciencemag.org/news/2016/04/whos-downloading-pirated-papers-everyone	3	1085	3255
12479297	Vim 8.0 released	https://groups.google.com/forum/#!topic/vim_announce/EKTuhjF3ET0	3	661	1983
12499655	Announcing new tools, forums, and features	https://github.com/blog/2256-a-whole-new-github-universe-announcing-new-tools-forums-and-features	3	1142	3426
12502947	Angular 2 Final Released	https://angular.io/	3	838	2514
12654093	Apple Has Removed Dash from the App Store	https://blog.kapeli.com/apple-removed-dash-from-the-app-store	3	1036	3108
12654499	Google Noto Fonts	https://www.google.com/get/noto/	4	903	3612
12711511	Books programmers don\'t really read	https://www.billthelizard.com/2008/12/books-programmers-dont-really-read.html	7	316	2212
12885435	Doing Business in Japan	https://www.kalzumeus.com/2014/11/07/doing-business-in-japan/	3	818	2454
13083766	Technical Papers Every Programmer Should Read (At Least Twice)	https://blog.fogus.me/2011/09/08/10-technical-papers-every-programmer-should-read-at-least-twice/	5	366	1830
13105803	Amazon Go	https://amazon.com/go	3	1247	3741
13182120	Yahoo installed a backdoor for the NSA behind the back of the security team	https://diracdeltas.github.io/blog/surveillance/	3	1009	3027
13190824	Google Web Designer	https://www.google.com/webdesigner/	4	781.5	3126
13192597	The second operating system hiding in every mobile phone	https://www.osnews.com/story/27416/The_second_operating_system_hiding_in_every_mobile_phone	3	1036	3108
13295540	Lavabit abruptly shuts down	https://lavabit.com/	3	1831	5493
13909365	They Used To Last 50 Years	https://recraigslist.com/2015/10/they-used-to-last-50-years/	3	1359	4077
13918465	Beautiful Online SICP	https://sarabander.github.io/sicp/	3	762	2286
14075720	Semantic UI	https://semantic-ui.com/	3	768	2304
14151842	I Can’t Write My Name in Unicode	https://modelviewculture.com/pieces/i-can-text-you-a-pile-of-poo-but-i-cant-write-my-name	3	610	1830
14186329	All of Bach	https://allofbach.com/en/	3	607	1821
14344034	AI Playbook	https://aiplaybook.a16z.com/	3	806	2418
14350293	Maru OS – A complete desktop experience on a smartphone	https://maruos.com/#/	3	652	1956
14401399	Don\'t use Hadoop when your data isn\'t that big (2013)	https://www.chrisstucchio.com/blog/2013/hadoop_hatred.html	4	598	2392
14475884	A hands-on introduction to video technology: image, video, codec and more	https://github.com/leandromoreira/digital_video_introduction	3	694	2082
14836653	How a VC-funded company is undermining the open-source community	https://theoutline.com/post/1953/how-a-vc-funded-company-is-undermining-the-open-source-community	3	1014	3042
14848840	“We will stop updating and distributing the Flash Player at the end of 2020”	https://blogs.adobe.com/conversations/2017/07/adobe-flash-update.html	3	1213	3639
15050841	Explaining React\'s license	https://code.facebook.com/posts/112130496157735/explaining-react-s-license/	3	978	2934
15127633	24/192 music downloads are silly	https://xiph.org/~xiphmont/demo/neil-young.html	5	604	3020
15145774	Email Encryption Software Relies on One Guy, Who Is Going Broke	https://www.propublica.org/article/the-worlds-email-encryption-software-relies-on-one-guy-who-is-going-broke	3	2088	6264
15172580	The Frameless Geodesic Dome I currently live in	https://rigsomelight.com/2013/09/09/frameless-geodesic-dome.html	3	747	2241
15254506	Statically Recompiling NES Games into Native Executables with LLVM and Go	https://andrewkelley.me/post/jamulator.html	4	458	1832
15507871	DevDocs API Documentation	https://devdocs.io/	3	1239	3717
15707956	Numpy: Plan for dropping Python 2.7 support	https://github.com/numpy/numpy/blob/master/doc/neps/dropping-python2.7-proposal.rst	3	662	1986
15746307	“Node.js is one of the worst things to happen to the software industry” (2012)	https://harmful.cat-v.org/software/node.js	3	624	1872
15754287	Battle for the Internet	https://www.battleforthenet.com/	4	1272	5088
15859849	PostgreSQL Exercises	https://pgexercises.com/	4	498	1992
15867918	The Big Vitamin D Mistake	https://www.ncbi.nlm.nih.gov/m/pubmed/28768407/	3	756	2268
15994410	How I went from $100-an-hour programming to $X0,000-a-week consulting	https://training.kalzumeus.com/newsletters/archive/consulting_1	4	907	3628
16065919	Reading privileged memory with a side-channel	https://googleprojectzero.blogspot.com/2018/01/reading-privileged-memory-with-side.html	3	2334	7002
16372886	Who Killed the Junior Developer?	https://medium.com/@melissamcewen/who-killed-the-junior-developer-33e9da2dc58c	3	803	2409
16642302	Drop Dropbox	https://www.drop-dropbox.com/	3	1990	5970
16703553	Organizing complexity is the most important skill in software development	https://www.johndcook.com/blog/2015/06/18/most-important-skill-in-software/	3	742	2226
16704489	Dear Mark Zuckerberg	https://daltoncaldwell.com/dear-mark-zuckerberg	3	743	2229
16728068	1.1.1.1: Fast, privacy-first consumer DNS service	https://blog.cloudflare.com/announcing-1111/	3	1895	5685
16773887	Hunting Down My Son\'s Killer	https://matt.might.net/articles/my-sons-killer/	3	1139	3417
16844775	ReactOS releases 0.4.8 with experimental Vista/7/10 software compatibility	https://reactos.org/project-news/reactos-048-released	3	617	1851
17081684	US cell carriers are selling access to real-time phone location data	https://www.zdnet.com/article/us-cell-carriers-selling-access-to-real-time-location-data/	3	1630	4890
17466400	Vue.js: the good, the meh, and the ugly	https://medium.com/@Pier/vue-js-the-good-the-meh-and-the-ugly-82800bbe6684	3	621	1863
17515746	“I\'m basically giving myself a permanent vacation from being BDFL”	https://mail.python.org/pipermail/python-committers/2018-July/005664.html	3	2024	6072
17682494	Learning from Terminals to Design the Future of User Interfaces	https://brandur.org/interfaces	3	785	2355
17685858	4D toys	https://4dtoys.com/	3	592	1776
17786061	Linus Torvalds: Make 2560x1600 the new standard laptop resolution	https://plus.google.com/+LinusTorvalds/posts/ByVPmsSeSEG	3	633	1899
17940172	Tools of the Trade, from Hacker News	https://github.com/cjbarber/ToolsOfTheTrade	3	581	1743
18161623	The Hiring Post	https://sockpuppet.org/blog/2015/03/06/the-hiring-post/	3	577	1731
18475518	Amazon Web Services in Plain English	https://www.expeditedssl.com/aws-in-plain-english	3	655	1965
18538881	I still miss my headphone jack, and I want it back	https://www.fastcompany.com/90270691/i-still-miss-my-headphone-jack-and-i-want-it-back	3	805	2415
18552442	Project Fi by Google	https://fi.google.com/about/	3	1107	3321
18678314	Introduction to Applied Linear Algebra: Vectors, Matrices, and Least Squares	https://vmls-book.stanford.edu/	3	938	2814
18757895	Mental Models I Find Repeatedly Useful	https://medium.com/@yegg/mental-models-i-find-repeatedly-useful-936f1cc405d	4	622	2488
18761910	Buttery Smooth Emacs	https://www.facebook.com/notes/daniel-colascione/buttery-smooth-emacs/10155313440066102/	3	651	1953
18776618	Reverse engineering guide for beginners: Methodology and tools	https://0x00sec.org/t/re-guide-for-beginners-methodology-and-tools/2242	3	801	2403
18800172	Identity Theft, Credit Reports, and You	https://www.kalzumeus.com/2017/09/09/identity-theft-credit-reports/	3	1088	3264
18818412	Software Engineering at Google (2017)	https://arxiv.org/abs/1702.01715	3	685	2055
18840747	Hacker\'s Guide to Neural Networks	https://karpathy.github.io/neuralnets/	5	424	2120
18848389	Announcing unlimited free private repos	https://blog.github.com/2019-01-07-new-year-new-github/	3	2867	8601
19038159	DuckDuckGo moves beyond search to also protect you while browsing	https://spreadprivacy.com/privacy-simplified/	3	727	2181
19069526	Helping a Million Developers Exit Vim	https://stackoverflow.blog/2017/05/23/stack-overflow-helping-one-million-developers-exit-vim/	3	775	2325
19238221	How Discord Scaled Elixir to 5M Concurrent Users	https://blog.discordapp.com/scaling-elixir-f9b8e1e7c29b	4	665	2660
19301570	TLDR Stock Options	https://tldroptions.io/	4	655.5	2622
19386694	Gwern\'s Law: Ads cost you a tenth of your users	https://twitter.com/gwern/status/1103855323100708866	3	620	1860
19477868	Mathigon – an interactive, personalized mathematics textbook	https://mathigon.org/	3	920	2760
19488782	Fuchsia OS Introduction	https://bzdww.com/article/163937/	3	580	1740
19576092	You Are Not Google (2017)	https://blog.bradfieldcs.com/you-are-not-google-84912cf44afb	3	1623	4869
19607449	Show HN: Web Design in 4 minutes	https://jgthms.com/web-design-in-4-minutes/	3	1624	4872
19624226	Unveiling the first-ever image of a black hole [video]	https://www.youtube.com/watch?v=Dr20f19czeE	3	2164	6492
19625874	Moved ~/.local/share/steam. Ran steam. It deleted everything owned by user	https://github.com/ValveSoftware/steam-for-linux/issues/3671	3	603	1809
20145035	Screenshots from developers and Unix people taken in 2002	https://anders.unix.se/2015/10/28/screenshots-from-developers--unix-people-2002/	4	481	1924
20326909	Advanced Data Structures	https://courses.csail.mit.edu/6.851/	3	1276	3828
20432772	YouTube videos that have almost zero previous views	https://astronaut.io/	3	1362	4086
20570025	Math Basics for Computer Science and Machine Learning [pdf]	https://www.cis.upenn.edu/~jean/math-basics.pdf	3	883	2649
20605660	Hy	https://en.wikipedia.org/wiki/Hy	3	850	2550
20646372	GitHub Actions now supports CI/CD, free for public repositories	https://github.blog/2019-08-08-github-actions-now-supports-ci-cd/	3	680	2040
20708928	People Simply Empty Out (1986)	https://www.lettersofnote.com/2012/10/people-simply-empty-out.html	4	561	2244
20723136	An Open Letter to Intel	https://www.cs.vu.nl/~ast/intel/	3	996	2988
20724672	Parsing JSON Is a Minefield (2018)	https://seriot.ch/parsing_json.php	6	339	2034
20734384	How to Build Good Software	https://www.csc.gov.sg/articles/how-to-build-good-software	3	1016	3048
20786448	Software Architecture Guide	https://martinfowler.com/architecture/	3	803	2409
20808398	LibreTaxi – A free and open source alternative to Uber and Lyft	https://libretaxi.org/	3	1275	3825
21036037	Why I Write Games in C (yes, C)	https://jonathanwhiting.com/writing/blog/games_in_c/	3	647	1941
21188092	Supreme Court allows blind people to sue retailers if websites aren\'t accessible	https://www.latimes.com/politics/story/2019-10-07/blind-person-dominos-ada-supreme-court-disabled	3	743	2229
21208927	Serverless Architectures	https://martinfowler.com/articles/serverless.html	5	426	2130
21217426	Broken	https://tyler.io/broken/	3	1354	4062
21274511	Gitlab: don\'t discuss politics at work	https://www.theregister.co.uk/2019/10/16/gitlab_employees_gagged/	3	1166	3498
21297462	Music Theory for Musicians and Normal People	https://tobyrush.com/theorypages/index.html	4	476	1904
21350246	How SSH got port number 22	https://www.ssh.com/ssh/port	4	708	2832
21401973	Twitter to ban political advertising	https://twitter.com/jack/status/1189634360472829952	3	2447	7341
21415463	Please don\'t use Slack for FOSS projects	https://drewdevault.com/2015/11/01/Please-stop-using-slack.html	4	749	2996
21504672	Makers, Don\'t Let Yourself Be Forced into the \'Manager Schedule\'	https://blog.nuclino.com/makers-don-t-let-yourself-be-forced-into-the-manager-schedule	3	798	2394
21565624	The cognitive costs of air pollution	https://patrickcollison.com/pollution	3	1020	3060
21617643	Boot a linux kernel right inside your browser. 	https://bellard.org/jslinux/	4	1066	4264
21678954	Show HN: Termtosvg – Record terminal sessions as SVG animations	https://github.com/nbedos/termtosvg	3	767	2301
21788356	Enough with the dead butterflies	https://emilydamstra.com/news/please-enough-dead-butterflies/	3	586	1758
21892714	Apple News No Longer Supports RSS	https://mjtsai.com/blog/2019/12/26/apple-news-no-longer-supports-rss/	3	781	2343
21903207	A Pixel Artist Renounces Pixel Art (2015)	https://www.dinofarmgames.com/a-pixel-artist-renounces-pixel-art/	5	357	1785
21951994	Chrome breaks the Web	https://tonsky.me/blog/chrome-intervention/	3	1187	3561
22004066	Show HN: Hacker News Classics	https://jsomers.net/hn	3	864	2592
22004998	Fireflies	https://ncase.me/fireflies/	3	1243	3729
22007863	Make your own sourdough	https://github.com/hendricius/the-bread-code/blob/master/basics/sourdough.md	3	619	1857
22033833	Academic Torrents – Making 27TB of research data available	https://academictorrents.com/	5	552	2760
22151396	Responsive Pixel Art	https://essenmitsosse.de/pixel/	3	1622	4866
22157430	“My wife has complained that OpenOffice will never print on Tuesdays” (2009)	https://bugs.launchpad.net/ubuntu/+source/cupsys/+bug/255161/comments/28	6	419	2514
22202110	The EARN IT Act: how to ban end-to-end encryption without banning it	https://cyberlaw.stanford.edu/blog/2020/01/earn-it-act-how-ban-end-end-encryption-without-actually-banning-it	3	613	1839
22261612	Free Lossless Image Format	https://flif.info/	4	972.5	3890
22281801	Web Design: The First 100 Years (2014)	https://idlewords.com/talks/web_design_first_100_years.htm	3	988	2964
22283673	Revised and much faster, run your own high-end cloud gaming service on EC2	https://lg.io/2015/07/05/revised-and-much-faster-run-your-own-highend-cloud-gaming-service-on-ec2.html	3	592	1776
22373906	Guide to Equity Compensation	https://www.holloway.com/g/equity-compensation	4	437.5	1750
22462628	Fork() can fail: this is important (2014)	https://rachelbythebay.com/w/2014/08/19/fork/	4	494.5	1978
22491170	“Let’s use Kubernetes.” Now you have eight problems	https://pythonspeed.com/articles/dont-need-kubernetes/	3	719	2157
22524026	Using Anki to remember what you read	https://superorganizers.substack.com/p/how-to-build-a-learning-machine	3	901	2703
22610829	TikTok told moderators to suppress posts by “ugly” people and the poor	https://theintercept.com/2020/03/16/tiktok-app-moderators-users-discrimination/	3	790	2370
22694891	Zotero: Personal Research Assistant	https://www.zotero.org/	3	945	2835
22711194	New Grad vs. Senior Dev	https://ericlippert.com/2020/03/27/new-grad-vs-senior-dev/	3	788	2364
22797688	Containers vs. Zones vs. Jails vs. VMs (2017)	https://blog.jessfraz.com/post/containers-zones-jails-vms/	5	351	1755
22815453	New Google SRE book: Building Secure and Reliable Systems	https://landing.google.com/sre/books/	3	1429	4287
22820852	Swift: Google’s Bet on Differentiable Programming	https://tryolabs.com/blog/2020/04/02/swift-googles-bet-on-differentiable-programming/	3	675	2025
22942278	Things I wished more developers knew about databases	https://medium.com/@rakyll/things-i-wished-more-developers-knew-about-databases-2d0178464f78	3	1011	3033
22943749	Conversations with a six-year-old on functional programming (2018)	https://byorgey.wordpress.com/2018/05/06/conversations-with-a-six-year-old-on-functional-programming/	4	1327	5308
23094477	Buttplug: An open-source software suite for teledildonics	https://buttplug.io/	3	770	2310
23104702	Zoom Acquires Keybase	https://keybase.io/blog/keybase-joins-zoom	4	995	3980
23235278	How to Center in CSS	https://howtocenterincss.com/	4	598.5	2394
23241040	DirectX is coming to the Windows Subsystem for Linux	https://devblogs.microsoft.com/directx/directx-heart-linux/	3	706	2118
23290844	Jepsen: MongoDB 4.2.6	https://jepsen.io/analyses/mongodb-4.2.6	3	604	1812
23430671	It is as if you were doing work	https://pippinbarr.github.io/itisasifyouweredoingwork/	3	752	2256
23444864	Google Chromium, sans integration with Google	https://github.com/Eloston/ungoogled-chromium	6	688	4128
23484378	Woodworking for Engineers	https://woodgears.ca/	3	715	2145
23487140	What happens when you ask people to draw a bike (2016)	https://www.gianlucagimini.it/prototypes/velocipedia.html	4	498	1992
23543043	Drive through cities in the browser while listening to local radio stations	https://driveandlisten.herokuapp.com/	3	804	2412
23572023	Let them paste passwords	https://www.ncsc.gov.uk/blog-post/let-them-paste-passwords	3	694	2082
23582280	An Intro to Compilers	https://nicoleorchard.com/blog/compilers	3	687	2061
23701053	Almost everything on computers is perceptually slower than it was in 1983 (2017)	https://twitter.com/gravislizard/status/927593460642615296	5	461	2305
23739596	The Wrong Abstraction (2016)	https://www.sandimetz.com/blog/2016/1/20/the-wrong-abstraction	6	654	3924
23756921	Only 9% of visitors give GDPR consent to be tracked	https://markosaric.com/gdpr-consent/	3	651	1953
23845575	Deep Work and the 30-Hour Method for Learning a New Skill (2018)	https://azeria-labs.com/the-importance-of-deep-work-the-30-hour-method-for-learning-a-new-skill/	4	891.5	3566
23948280	Why Google Stores Billions of Lines of Code in a Single Repository (2016)	https://cacm.acm.org/magazines/2016/7/204032-why-google-stores-billions-of-lines-of-code-in-a-single-repository/fulltext	5	391	1955
23981795	Hiring Without Whiteboards	https://github.com/poteto/hiring-without-whiteboards	5	423	2115
23996756	Learn FFmpeg the hard way	https://github.com/leandromoreira/ffmpeg-libav-tutorial#learn-ffmpeg-libav-the-hard-way	3	586	1758
24100105	Linus Torvalds apologizes for his behavior, takes time off	https://lore.kernel.org/lkml/CA+55aFy+Hv9O5citAawS+mVZO+ywCKd9NQ2wxUmGsz9ZJzqgJQ@mail.gmail.com/	3	2585	7755
24103233	GraalVM: Run Programs Faster Anywhere	https://www.graalvm.org/	4	453.5	1814
24167873	Every Byte of a TLS Connection Explained and Reproduced	https://tls.ulfheim.net/	3	1185	3555
24256676	Questions	https://patrickcollison.com/questions	3	1106	3318
24343710	Nvidia Unveils GeForce RTX 30 Series GPUs	https://blogs.nvidia.com/blog/2020/09/01/nvidia-ceo-geforce-rtx-30-series-gpus/	3	856	2568
24372584	Reddit app got 50M downloads by making mobile web experience miserable	https://www.androidpolice.com/2020/09/02/reddit-gets-its-app-to-50-million-play-store-downloads-mostly-by-making-the-mobile-web-experience-miserable/	3	710	2130
24476059	Show HN: Make your site’s pages instant in one minute	https://instant.page/	3	1214	3642
24532973	uMatrix has been archived	https://github.com/gorhill/uMatrix	3	631	1893
24546250	The San Franciso Fire Department makes its own wooden ladders by hand	https://gizmodo.com/inside-san-francisos-fire-department-where-ladders-are-1552279252	3	579	1737
24571292	They\'re deleting my channel, but they don\'t know why? [video]	https://www.youtube.com/watch?v=hAEdFRoOYs0	3	987	2961
24633484	Seeing Theory: A Visual Introduction to Probability and Statistics	https://seeing-theory.brown.edu/index.html	4	522.5	2090
24707407	Show HN: I built a Rotten Tomatoes-style platform for durable products	https://www.buyforlifeproducts.com/	3	1392	4176
24745868	This person does not exist	https://thispersondoesnotexist.com/	3	872	2616
24839451	HTTP/3 explained	https://http3-explained.haxx.se/en/	3	716	2148
24867685	Mathematics for Computer Science [pdf]	https://courses.csail.mit.edu/6.042/spring17/mcs.pdf	3	1059	3177
24882480	Pandoc – A universal document converter	https://pandoc.org/	4	886	3544
24951351	Photos from inside a Typhoon class submarine	https://ru-submarine.livejournal.com/17486.html	3	610	1830
25033545	Scenic Tram Simulator	https://alexanderperrin.com.au/paper/shorttrip/	3	918	2754
25100241	BetterExplained: Math Lessons That Explain Concepts	https://betterexplained.com/	4	503	2012
25113132	YouTube-dl\'s repository has been restored	https://github.blog/2020-11-16-standing-up-for-developers-youtube-dl-is-back/	4	1955.5	7822
25180180	Building Your Color Palette	https://refactoringui.com/previews/building-your-color-palette/	3	1019	3057
25226805	CAPTCHAs don’t prove you’re human – they prove you’re American (2017)	https://shkspr.mobi/blog/2017/11/captchas-dont-prove-youre-human-they-prove-youre-american/	3	696	2088
25254772	AlphaFold: a solution to a 50-year-old grand challenge in biology	https://deepmind.com/blog/article/alphafold-a-solution-to-a-50-year-old-grand-challenge-in-biology	3	1398	4194
25277280	Rga: Ripgrep, but also search in PDFs, E-Books, Office documents, zip, tar.gz	https://phiresky.github.io/blog/2019/rga--ripgrep-for-zip-targz-docx-odt-epub-jpg/	3	684	2052
25313010	Radicle: A peer-to-peer alternative to GitHub	https://radicle.xyz#/beta	3	864	2592
25333219	With Proton and Steam Play, many Windows games now work on Linux	https://www.protondb.com	3	938	2814
25373968	A former Uber engineer\'s disaster story	https://twitter.com/StanTwinB/status/1336890442768547845	3	710	2130
25440028	LinkedIn’s Alternate Universe	https://divinations.substack.com/p/linkedins-alternate-universe	3	613	1839
25443152	Firefox Was Always Enough	https://www.ianbicking.org/blog/2020/11/firefox-was-always-enough.html	3	1000	3000
25551122	Bye Bye Mongo, Hello Postgres	https://www.theguardian.com/info/2018/nov/30/bye-bye-mongo-hello-postgres	3	1562	4686
25600274	Most of what you read on the internet is written by insane people (2018)	https://www.reddit.com/r/slatestarcodex/comments/9rvroo/most_of_what_you_read_on_the_internet_is_written/	4	628.5	2514
25720872	Signal Foundation	https://signal.org/blog/signal-foundation/	3	1314	3942
25743546	Lulu – Mac open-source firewall that aims to block unknown outgoing connections	https://objective-see.com/products/lulu.html	4	584	2336
25849800	I tried creating a web browser and Google blocked me (2019)	https://blog.samuelmaddock.com/posts/google-widevine-blocked-my-browser/	4	1199.5	4798
25975273	Build Your Own X	https://github.com/danistefanovic/build-your-own-x	5	507	2535
25979584	The MIT License, Line by Line	https://writing.kemitchell.com/2016/09/21/MIT-License-Line-by-Line.html	6	371	2226
26025336	Del.icio.us	https://del.icio.us/	3	1649	4947
26051386	Operating Systems: Three Easy Pieces	https://pages.cs.wisc.edu/~remzi/OSTEP/	7	324	2268
26061935	Terraria on Stadia cancelled after developer\'s Google account gets locked	https://twitter.com/Demilogic/status/1358661840402845696	3	2023	6069
26082303	Police playing music while being filmed, seemingly to trigger copyright filters	https://www.vice.com/en/article/bvxb94/is-this-beverly-hills-cop-playing-sublimes-santeria-to-avoid-being-livestreamed	3	969	2907
26087064	Dependency Confusion: How I Hacked Into Apple, Microsoft and Other Companies	https://medium.com/@alex.birsan/dependency-confusion-4a5d60fec610	3	1107	3321
26114194	“I saw that you spun up an Ubuntu image in Azure”	https://twitter.com/LucaBongiorni/status/1359560585990537216	4	604	2416
26180785	Judge: Citibank isn\'t entitled to $500M it sent to various creditors last August	https://arstechnica.com/tech-policy/2021/02/citibank-just-got-a-500-million-lesson-in-the-importance-of-ui-design/	4	622	2488
